ID,HashTags,Tweet IDs,Time,TweetText,mentions_other,URL,User,calai_candidates,test_candidates,stanford_candidates,twiner_candidates,phase2_gt
287,,8.52E+017,4/12/2017 0:20,Sean Spicer falling flat on his ass. Carter Page under FISA warrant. Susan Rice exonerated by Dem AND GOP lawmakers. Am I dreaming?,"sean spicer;Carter Page,FISA;Susan Rice,Dem,GOP;",,EricRobertson,"gop,susan rice,carter page,his,sean spicer","sean spicer,carter page,susan rice,gop","sean spicer,susan rice",flat on his ass;spicer;am i dreaming;sean spicer falling;sean spicer,"sean spicer, sean, spicer;carter page,carter,page,fisa;susan rice,dem,gop;"
288,,8.52E+017,4/12/2017 0:31,"Thank you, @LouiseMensch for breaking this story. I don't always agree with your politics (well, never), but YOU got the scoop.",;,https://twitter.com/i/web/status/851955991356854272,Analogbear,,,,breaking this story;you louisemensch;this;the scoop;louisemensch for breaking this story,;
289,,8.52E+017,4/12/2017 0:31,Let me get this straight. The left is cheering the unmasking of private citizen Carter Page ? This should scare the hell out of you.,;Carter Page;,,TespGames,carter page,carter page,carter page,out of you;me get;straight the left;let;let me,";carter page,carter,page;"
290,,8.52E+017,4/12/2017 0:31,FBI obtained FISA warrant to monitor former Trump adviser Carter Page. Cause to believe he was agent of Russia,"FBI,FISA,Trump,Carter Page;Russia",https://www.washingtonpost.com/world/national-security/fbi-obtained-fisa-warrant-to-monitor-former-trump-adviser-carter-page/2017/04/11/620192ea-1e0e-11e7-ad74-3a742a6e93a7_story.html?utm_term=.f2e4be9b52a4,richardlorello,"carter page,he,fbi,russia,adviser,trump","fbi,trump,carter page,russia","fbi,fisa,trump,carter,russia",he was agent of russia;agent of russia;fisa warrant to monitor former;to monitor;obtained fisa warrant to monitor,"fbi,fisa,trump,carter page,carter,page;russia"
291,,8.52E+017,4/12/2017 0:31,.......he can lead the @fbi to big &amp; bigger elephants in room.,;,https://twitter.com/jimmurrayii/status/851941290870583296,jcbriones,"he,fbi",,,bigger elephants in room;elephants in room;he can lead;lead;in room,;
292,,8.52E+017,4/12/2017 0:32,"Reporter's reaction to Sean Spicer on Hitler - equally applicable to Carter Page's ""I'm basically MLK"" fuckery.","sean spicer,Hitler,Carter Page,MLK",https://twitter.com/purpledocket/status/851871113852452865,MsEntropy,"carter page,sean spicer,reporter","sean spicer,hitler,carter page","sean spicer,hitler,carter",to;spicer;reaction;reporter;sean spicer,"sean spicer, sean, spicer,hitler,carter page,carter,page,mlk"
293,,8.52E+017,4/12/2017 0:32,"""...carter...page...now theres a name i havent heard in years..""",carter;page;,,darth,,,,carter...page...now;a;theres a;i havent heard in years;years,carter;page;
294,,8.52E+017,4/12/2017 0:32,"So the plot thickens, another Russian Agent, Carter Page, and we knew about Mike Flynn, can't wait to see ALL fall on Trump's lap.","russian,Russian Agent,Carter Page,Flynn, Mike Flynn,Trump",,cpv820_valente,"carter page,mike flynn,trump","russian agent,carter page,mike flynn,trump",mike,plot thickens;thickens another russian agent;plot;on trump lap;trump lap,"russian,russian agent,carter page,carter,page,flynn, mike flynn,trump"
295,,8.52E+017,4/12/2017 0:32,FoxNews: Carter Page: FBI reportedly obtained FISA warrant to monitor ex-Trump adviser,"Carter Page,FBI,FISA,","http://www.foxnews.com/politics/2017/04/11/carter-page-fbi-reportedly-obtained-fisa-warrant-to-monitor-ex-trump-adviser.html, https://twitter.com/FoxNews/status/851955494184996864",House_Insider,"carter page,fbi,adviser,trump",carter page,"fbi,fisa",carter page fbi reportedly;page fbi reportedly;adviser;monitor ex-trump adviser;page fbi,"carter page,carter,page,fbi,fisa,"
296,,8.52E+017,4/12/2017 0:21,"""Our of our advisors was maybe a Russian intelligence asset"" is what passes for pro-Trump spin.",Russian intelligence,https://twitter.com/carney/status/851942259935367169,stanveuger,"advisors,trump,russian intelligence",,,our of;for pro-trump spin;was maybe;advisors was;was,russian intelligence
297,,8.52E+017,4/12/2017 0:32,@funder Didn't Jeff Sessions recommend Carter Page for the Trump campaign/administration??,"Jeff Sessions,Carter Page,Trump",,SandraPitts14,carter page,"jeff sessions,carter page","jeff sessions,trump",page for the trump campaign/administration;didnt jeff sessions;for the trump campaign/administration;funder;didnt jeff,"jeff sessions,carter page,carter,page,trump"
298,,8.52E+017,4/12/2017 0:32,ANYBODY TAKING BETS ON WHICH OF TRUMP'S BUDDIES WILL BLAB ABOUT THE RUSSIAN CONNECTION AND BRING HIM DOWN? My money's on Carter Page.,"TRUMP,RUSSIAN;Carter Page",,DianaCialino,"carter page,him,trump",carter page,carter page.,on which of trump;trump;anybody taking bets;anybody;my money on carter page,"trump,russian;carter page,carter,page"
299,,8.52E+017,4/12/2017 0:32,"if you had carter page on your ""fisa warrant bingo"" card, please step up and collect your winnings","Carter Page,fisa,",http://wapo.st/2pr7kpE?tid=ss_tw,mgerrydoyle,carter page,carter page,,you had carter page on;and collect your winnings;page on;had;up and collect your winnings,"carter page,carter,page,fisa,"
300,,8.52E+017,4/12/2017 0:32,My president fired $80m of missiles to change the narrative and all I got was Carter Page trending.,Carter Page,,JohnFugelsang,"carter page,president",carter page,,my president;got was carter page trending;page trending;president;my,"carter page,carter,page"
301,,8.52E+017,4/12/2017 0:32,@seanhannity and @marklevinshow &amp; others have lied about possible treason by Carter Page &amp; others. They're traitors for the obfuscation.,Carter Page;,https://twitter.com/i/web/status/851956074970136577,ColoradoHeathen,carter page,carter page,carter,and;and marklevinshow;and marklevinshow amp;seanhannity;obfuscation,"carter page,carter,page;"
302,,8.52E+017,4/12/2017 0:32,"@RVAwonk And it was Carter Page, like I thought!!!",Carter Page,,Utleyjacobite,carter page,carter page,carter,and;rvawonk;was;thought;rvawonk and it was,"carter page,carter,page"
303,trumprussia,8.52E+017,4/12/2017 0:32,"FBI believed Page ""engaged in clandestine intel activities on behalf of Moscow""

This is gettin good
","FBI,Page,Moscow;",https://www.washingtonpost.com/world/national-security/fbi-obtained-fisa-warrant-to-monitor-former-trump-adviser-carter-page/2017/04/11/620192ea-1e0e-11e7-ad74-3a742a6e93a7_story.html?utm_term=.f1384307f48e,karelvetrovec,"page,fbi,moscow,moscow"" {index","fbi believed page,moscow",fbi,fbi believed;believed page;is gettin good;believed;in clandestine,"fbi,page,moscow;"
304,,8.52E+017,4/12/2017 0:32,"@JSteria @LilMsgss Sessions too.≡ƒæç≡ƒÅ╝

",,https://www.washingtonpost.com/world/national-security/fbi-obtained-fisa-warrant-to-monitor-former-trump-adviser-carter-page/2017/04/11/620192ea-1e0e-11e7-ad74-3a742a6e93a7_story.html?utm_term=.a4a862b63be1,Tam_Resist,,,,lilmsgss sessions;lilmsgss sessions too.â¡æã¦ã§â¡æã â;jsteria lilmsgss sessions;lilmsgss;too.â¡æã¦ã§â¡æã â,
305,,8.52E+017,4/11/2017 23:27,"""Since the 90-day warrant was first issued, it has been renewed more than once by the FISA court, the officials said",fisa court,,jwomack,fisa court,,,90-day warrant was first issued;the officials said;the 90-day warrant;first;said,"fisa,fisa court"
306,,8.52E+017,4/12/2017 0:32,@seanhannity The LATEST news is Nunes is a proven liar and Carter Page is a foreign operative.,"Nunes,Carter Page",,EunuchTrump,"carter page,nunes,the latest news,a foreign operative","nunes,carter page","nunes,carter page",page is a foreign operative;seanhannity;the latest news is nunes;latest;is nunes,"nunes,carter page,carter,page"
307,"FBI, FISA, Trump, CarterPage",8.52E+017,4/12/2017 0:32," obtained  warrant to monitor former  adviser  

",,https://www.google.com/amp/s/www.washingtonpost.com/amphtml/world/national-security/fbi-obtained-fisa-warrant-to-monitor-former-trump-adviser-carter-page/2017/04/11/620192ea-1e0e-11e7-ad74-3a742a6e93a7_story.html,Spam4Trump,adviser,,,to monitor former adviser;to;adviser;obtained warrant to;warrant,
308,,8.52E+017,4/12/2017 0:32,Looks like there is something there.,,https://twitter.com/David4justice48/status/851955746472423425,Tweetypot,,,,is something there;there is something there;like;there;like there is something there,
309,,8.52E+017,4/12/2017 0:32,.Faaaaaaaaaaaaaaaacts,,https://twitter.com/mattmurph24/status/851943749102047233,sunnypeaceful01,,,,faaaaaaaaaaaaaaaacts,
310,"Trumprussia, TheResistance, russiagate",8.52E+017,4/12/2017 0:32,I'm soooo excited!!!,,https://twitter.com/TomParis2017/status/851953317370408960,RJG507089,,,,soooo excited;im soooo;im soooo excited;im;excited,
311,,8.52E+017,4/12/2017 0:32,"As stated previously, collusion at the top of the trump presidential run was and still is grounds for impeachment!
",trump,https://www.washingtonpost.com/world/national-security/fbi-obtained-fisa-warrant-to-monitor-former-trump-adviser-carter-page/2017/04/11/620192ea-1e0e-11e7-ad74-3a742a6e93a7_story.html?utm_term=.fcde4e51c2cc,RudyTejano,,trump,,stated previously collusion at the;stated;still is grounds for impeachment;stated previously;impeachment,trump
312,,8.52E+017,4/12/2017 0:32,FBI obtained FISA warrant to monitor former Trump adviser Carter Page - The Washington Post Must read....,"FBI,FISA,Trump,Carter Page,Washington Post",https://apple.news/AmhlIgr5lSp2IJH895iS7QA,tahoecalif,"carter page,fbi,adviser,trump","fbi,trump,carter page,the washington","fbi,fisa,trump",to;to monitor;fbi obtained;obtained fisa;read,"fbi,fisa,trump,carter page,carter,page,washington post"
313,,8.52E+017,4/12/2017 0:32,@oreillyfactor Trump advisor under investigation for colluding with Russia. A LEGAL FISA warrant.,"Trump,Russia;FISA,",https://www.washingtonpost.com/world/national-security/fbi-obtained-fisa-warrant-to-monitor-former-trump-adviser-carter-page/2017/04/11/620192ea-1e0e-11e7-ad74-3a742a6e93a7_story.html?utm_term=.28aa4dd6e786,bercbon4,"advisor,russia","trump,russi",trump,trump;oreillyfactor trump advisor under investigation;legal fisa warrant;oreillyfactor;a legal fisa warrant,"trump,russia;fisa,"
314,,8.52E+017,4/12/2017 0:32,Top News: FBI obtained FISA warrant to monitor former Trump adviser Carter Page - Washington Post,"FBI,FISA,Trump,Carter Page,Washington Post",http://ift.tt/2p3yMgA,FlabinAlert,"carter page,fbi,washington post,adviser,trump","fbi,trump,carter page,washington post","fbi,fisa,trump,carter page - washington post",top news;top news fbi;fbi obtained fisa warrant;adviser carter page washington post;fbi obtained fisa,"fbi,fisa,trump,carter page,carter,page,washington post"
315,,8.52E+017,4/12/2017 0:32,@HeyTammyBruce FBI  / Hillary's Andrew McCabe was secretly working with Lynch/Obama/Rice to spy on Donald Trump team VIA any means necessary! Carter Page,"FBI,Hillary,Andrew McCabe,Lynch/Obama/Rice,Trump, Donald Trump;Carter Page",https://twitter.com/i/web/status/851956179580399616,glennyork,"carter page,fbi,andrew mccabe,donald trump","fbi,hillary,andrew mccabe,donald trump,carter page","fbi,andrew mccabe,donald trump",heytammybruce fbi;hillary;heytammybruce fbi hillary;mccabe was secretly;necessary carter page,"fbi,hillary,hillary's andrew mccabe,andrew mccabe,lynch/obama/rice,trump, donald trump;carter page,carter,page"
316,,8.52E+017,4/12/2017 0:32,Imagine if Hillary had so many Russian ties.  Imagine if she had so many people in her campaign linked to Putin himself,"Hillary,Russian;Putin",https://twitter.com/i/web/status/851956183103614978,colin_havens,"putin,her,she","imagine,hillary","hillary,putin",hillary;to putin himself;so many russian;hillary had so many russian;linked to putin himself,"hillary,russian;putin"
317,,8.52E+017,4/12/2017 0:24,Dude.,,https://www.washingtonpost.com/world/national-security/fbi-obtained-fisa-warrant-to-monitor-former-trump-adviser-carter-page/2017/04/11/620192ea-1e0e-11e7-ad74-3a742a6e93a7_story.html?utm_term=.01e7fe44ba24,katherinemiller,,,,dude,
318,,8.52E+017,4/12/2017 0:32,This is really fucking incredible. One does not simply walk into FISA Court with mere suspicions.,;FISA,https://twitter.com/ddiamond/status/851946646787284993,lakefxdan,fisa court,fisa court,fisa court,incredible;fisa court with mere suspicions;incredible one;is really;this,;fisa
319,,8.52E+017,4/12/2017 0:32,Still is?,,https://twitter.com/thedecider99/status/851951798655094784,ofpeopl,,,,still;is;still is,
320,,8.52E+017,4/12/2017 0:32,But remember the real issue is the leaks from Obama officials that may or may not have happened,Obama,https://twitter.com/brianklaas/status/851953170448343040,Steven_Strauss,,obama,obama,but remember;have happened;the real issue is;remember the;real issue is,obama
321,,8.52E+017,4/12/2017 0:32,"World News; ""FBI obtained FISA warrant to monitor former Trump adviser Carter Page - Washington Post""","FBI,FISA,Trump,Carter Page,Washington Post",http://bit.ly/2prdmX2,Ubertr0_nNub,"carter page,fbi,washington post,adviser,trump","fbi,trump,carter page,washington post","fisa,trump,carter page,washington",fbi obtained fisa warrant;adviser carter page washington post;fbi obtained fisa;obtained fisa;news fbi obtained fisa,"fbi,fisa,trump,carter page,carter,page,washington post"
322,"resist, trumprussia",8.52E+017,4/12/2017 0:32,"BREAKING: There's smoke, &amp; now fire. FBI rec'd FISA warrant to watch DT advisor Carter Page.",";FBI,FISA,Carter Page",http://wapo.st/2pr7kpE?tid=ss_tw,BanditRandom,"carter page,fbi,dt advisor","dt,carter page","fbi,carter page.",there smoke;watch dt advisor carter page;now fire;advisor carter page;now,"fbi,fisa,fisa,carter page,carter,page"
323,,8.52E+017,4/12/2017 0:32,"When will he sing?
Carter Page: FBI reportedly obtained FISA warrant to monitor ex-Trump adviser |",";Carter Page,FBI,FISA,",http://fxn.ws/2owUlW4,criticalblah,"carter page,he,fbi,adviser,trump",carter page,"fbi,fisa",adviser;when will;he sing carter page;he sing carter;will he,";carter page,carter,page,fbi,fisa,"
324,,8.52E+017,4/12/2017 0:32,FBI received warrant to monitor Trump adviser Carter Page: report,"FBI,Trump,Carter Page",http://nydn.us/2oqlDgB,AmericanCFLFan,"carter page,fbi,adviser,trump","trump,carter page","fbi,trump,carter",to;trump adviser carter page report;fbi received warrant to;received;adviser carter page report,"fbi,trump,carter page,carter,page"
325,,8.52E+017,4/12/2017 0:32,"How about some American news? If you are looking for topics, there's Holocaust Centers, Nunes and Carter Page, @oreillyfactor","American;Holocaust Centers,Nunes,Carter Page",https://twitter.com/i/web/status/851956229958238209,therepublitard,"carter page,nunes","holocaust centers,nunes,carter page",carter,how about some;how about;about some american news if;about;oreillyfactor,"american;holocaust centers,nunes,carter page,carter,page"
326,,8.52E+017,4/12/2017 0:32,@morninggloria may want to focus on this one tho:,,https://www.washingtonpost.com/world/national-security/fbi-obtained-fisa-warrant-to-monitor-former-trump-adviser-carter-page/2017/04/11/620192ea-1e0e-11e7-ad74-3a742a6e93a7_story.html?hpid=hp_hp-top-table-main_page710pm%3Ahomepage%2Fstory&utm_term=.48bc6a,the1duncan,,,,to;may want;morninggloria may;morninggloria;want,
327,,8.52E+017,4/12/2017 0:32,"trump is going down, trump is going down, trump is going down","trump,trump,trump",https://www.washingtonpost.com/world/national-security/fbi-obtained-fisa-warrant-to-monitor-former-trump-adviser-carter-page/2017/04/11/620192ea-1e0e-11e7-ad74-3a742a6e93a7_story.html?utm_term=.174dc94edc57,KnowYourObama,,,,trump;trump is going down;going;going down;is going,"trump,trump,trump"
328,,8.52E+017,4/11/2017 23:44,"QUESTION: ""Announcing your foreign policy team shortly Any you can share with us?""

TRUMP: ""Carter Page, PhD",";TRUMP,Carter Page",,OscarNunezLA,"carter page, phd,trump","trump,carter page",,phd;your;announcing your;team;announcing your foreign,";trump,carter page,carter,page"
329,,8.52E+017,4/12/2017 0:32,"Oh, I dunno, maybe two toddlers with nukes off the Korean Peninsula and one of them has had a really bad day?",The Korean Peninsula,https://twitter.com/AdamBlickstein/status/851952225677176832,revanner,the korean peninsula,korean peninsula,korean peninsula,day;really bad day;maybe two toddlers with;dunno;bad day,the korean peninsula
330,,8.52E+017,4/12/2017 0:32,@LouiseMensch FISA warrant was issued on Carter Page ... breaking on MSNBC,"FISA,Carter Page,MSNBC",,KarenBlumentha1,carter page,"carter page,msnbc",msnbc,fisa warrant was;carter page breaking on msnbc;warrant was;on msnbc;fisa warrant,"fisa,carter page,carter,page,msnbc"
331,,8.52E+017,4/12/2017 0:33,Devin Nunes and Carter Page stories hitting at the same time ... expect an AM potus tweet storm... or we bomb Syria again ≡ƒñö,"Nunes,Devin Nunes,Carter Page;;Syria",,JamBrandMrktng,"carter page,syria,devin nunes","devin nunes,carter page,syria","devin nunes,carter page,syria",and carter;syria again â¡æã±ã¶;and;we bomb syria again â¡æã±ã¶;carter page stories hitting,"nunes,devin nunes,carter page,carter,page;;syria"
332,reeee,8.52E+017,4/12/2017 0:33,"Trump: ""We are not going into Syria"". Media: ""SEAN SPICER IS AN ANTI SEMITE HOLOCAUST DENIER AND CARTER PAGE IS A RUSSIAN AGENT!!!""","Trump,Syria;sean spicer,HOLOCAUST DENIER,Carter Page,RUSSIAN AGENT",,atkhelo,"carter page,syria,trump","syria,sean spicer,carter page","spicer,carter",trump;is a russian agent;trump we are;not going into syria;are not,"trump,syria;sean spicer, sean, spicer,holocaust denier,carter page,carter,page,russian,russian agent"
333,,8.52E+017,4/12/2017 0:33,FBI obtained FISA warrant to monitor former Trump adviser Carter Page - The Washington Post NOTHING TO C HERE FOLKS!,"FBI,FISA,Trump,Carter Page,Washington Post",https://www.washingtonpost.com/world/national-security/fbi-obtained-fisa-warrant-to-monitor-former-trump-adviser-carter-page/2017/04/11/620192ea-1e0e-11e7-ad74-3a742a6e93a7_story.html?utm_term=.2a08eb0b5d08&wpisrc=al_alert-COMBO-politics%252Bnation&wpmk=1,SallySellers54,"carter page,fbi,adviser,trump","fbi,trump,carter page,the washington post","fbi,fisa,trump,washington post",fisa warrant to monitor former;to monitor;obtained fisa warrant to monitor;fbi obtained fisa;fbi obtained,"fbi,fisa,trump,carter page,carter,page,washington post"
334,"tcot, news, variety",8.52E+017,4/12/2017 0:33,"   Carter Page, Former Trump Adviser, Monitored Last Summer By FBI Over Russian Contacts","Carter Page,Trump,FBI,Russian",http://dlvr.it/NsY3jp,littlebytesnews,"monitored last,carter page,fbi,adviser","carter page,fbi","carter,fbi",fbi over russian contacts;by fbi over russian contacts;adviser;trump adviser;page former trump adviser,"carter page,carter,page,trump,fbi,russian"
335,TrumpRussiaCollusion,8.52E+017,4/12/2017 0:33,FISA court granted FBI authority to monitor Trump adviser Carter Page during campaign:,"FISA,FBI,Trump,Carter Page",http://www.slate.com/blogs/the_slatest/2017/04/11/fisa_court_allowed_fbi_surveillance_of_trump_adviser_carter_page_during.html?wpsrc=sh_all_tab_tw_top,4citkane,"carter page,fbi,fisa court,adviser,trump,carter page during","trump,carter page","fbi,trump",granted;fbi authority;fisa;page during campaign;authority,"fisa,fbi,trump,carter page,carter,page"
336,,8.52E+017,4/12/2017 0:33,@KeithOlbermann So Does This Mean The FBI Was Listening to Every Conversation PAGE Had....TRUMP Loved Carter Page. ..Interesting? ?????,"FBI,PAGE;TRUMP,Carter Page;",,Bulldawg2482,"carter page,fbi","conversation page,trump,carter page",fbi,mean the;so does;does;carter page interesting;so does this mean the,"fbi,page;trump,carter page,carter,page;"
337,,8.52E+017,4/12/2017 0:33,"FBI obtained FISA warrant to monitor former Trump adviser Carter Page
","FBI,FISA,Trump,Carter Page",http://wapo.st/2pr7kpE,rxflg,"carter page,fbi,adviser,trump","fbi,trump,carter page","fbi,fisa,trump,carter page",fbi obtained fisa warrant;warrant;fbi obtained fisa;fbi obtained;obtained fisa,"fbi,fisa,trump,carter page,carter,page"
338,finance,8.52E+017,4/12/2017 0:33,FBI had FISA warrant to snoop on ex-Trump adviser Carter Page: report,"FBI,FISA,Carter Page",http://dlvr.it/NsY3hM,financeprnews,"carter page,fbi,adviser,trump","fbi,snoop,carter page","fbi,carter",to;fbi had;had fisa warrant to;had fisa;ex-trump adviser carter page report,"fbi,fisa,carter page,carter,page"
339,"carterpage, traitortrump, Trumprussia",8.52E+017,4/12/2017 0:33,AND Republican FBI Director Comey REFUSED to tell voters during the election,"FBI,Republican FBI Director Comey,Comey,",https://twitter.com/i/web/status/851956322832719873,pqpolitics,"fbi,director comey",,"fbi,comey",and;the election;republican fbi director comey;comey;election,"fbi,republican fbi director comey,comey,"
340,,8.52E+017,4/11/2017 23:38,A FISA warrant investigated Carter Page.,"FISA,Carter Page",https://www.washingtonpost.com/world/national-security/fbi-obtained-fisa-warrant-to-monitor-former-trump-adviser-carter-page/2017/04/11/620192ea-1e0e-11e7-ad74-3a742a6e93a7_story.html?utm_term=.abcf5ab63a74,kaykas,carter page,carter page,carter page.,a;warrant;fisa warrant investigated;warrant investigated carter page;fisa warrant,"fisa,carter page,carter,page"
341,,8.52E+017,4/11/2017 23:36,Unprecedented. A federal court found probable cause an advisor to the next president of the United States was acting,;United States,,darlin,"an advisor,united states,president of the united states",united states,united states,acting;a federal court found probable;a;unprecedented a federal;federal court found probable,;united states
342,"Resist, Trumprussia",8.52E+017,4/12/2017 0:33,"And with""Carter Page"" lets take back the peoples house @realdonaldtrump @mike_pence @jaredkushner made it Russias house","Carter Page,Russias",,Itsafairday,carter page,"carter page,russias house",,jaredkushner made it russias house;and;page lets take back;house;page lets take,"carter page,carter,page,russias"
343,,8.52E+017,4/12/2017 0:33,"Carter Page comparing himself to MLK. Spicer's Hitler ""analogy."" What is going on?","Carter Page,MLK;Spicer,Hitler;",https://twitter.com/aaronblake/status/851944666958352384,bstrawbridge,"hitler,carter page,spicer","carter page,mlk.spicer 's hitler","carter page,hitler",to;what is going on;carter page;himself to;comparing,"carter page,carter,page,mlk;spicer,hitler;"
344,trumprussia,8.52E+017,4/12/2017 0:33,AND....in other news:  FBI did obtain a legal FISA warrant. On Carter Page. This is a big fucking deal,"FBI,FISA;Carter Page;",https://twitter.com/i/web/status/851956345238544385,LisaMorrellRRT,"carter page,fbi",carter page,fbi,and....in other;fbi did obtain;other news;news fbi did obtain a;is a big fucking deal,"fbi,fisa;carter page,carter,page;"
345,,8.52E+017,4/12/2017 0:33,FBI obtained FISA warrant to monitor former Trump adviser Carter Page - Washington Post,"FBI,FISA,Trump,Carter Page,Washington Post","https://lzodevelopment.com, https://twitter.com/i/web/status/851956345360314368",lzodevelopment,"carter page,fbi,washington post,adviser,trump","fbi,trump,carter page,washington post","fbi,fisa,trump,carter page - washington post",to;adviser carter page washington post;fbi obtained;obtained fisa;page washington post,"fbi,fisa,trump,carter page,carter,page,washington post"
346,"F4F, RT, news, FBI",8.52E+017,4/12/2017 0:33,obtained FISA warrant to monitor former Trump adviser Carter Page - Washington Post,"FISA,Trump,Carter Page,Washington Post",http://ift.tt/2prm5bM,WorldNews707,"carter page,washington post,adviser,trump","trump,carter page,washington post","fisa,trump,carter page - washington post",to;adviser carter page washington post;warrant;obtained fisa;fisa warrant,"fisa,trump,carter page,carter,page,washington post"
347,,8.52E+017,4/12/2017 0:33,Report: FISA court approved FBI's request to spy on Carter Page,"FISA,fisa court,FBI,Carter Page",http://www.washingtonexaminer.com/article/2620046,hrothenb,"carter page,fbi,fisa court","fbi,carter page",,spy on carter page;report fisa court approved;carter page;court approved fbi;fisa,"fisa,fisa court,fbi,carter page,carter,page"
348,,8.52E+017,4/12/2017 0:33,this is the dumbest show on television,,https://twitter.com/ddiamond/status/851946646787284993,mikescalise,,,,dumbest show on television;is the dumbest;is the;this;is,
349,,8.52E+017,4/12/2017 0:33,@KeithOlbermann Jeff Sessions recommended Carter Page for Trump campaign/admin.,"Jeff Sessions,Carter Page,Trump",,SandraPitts14,"carter page,trump","jeff sessions,carter page,trump","jeff sessions,carter page,trump",jeff;jeff sessions recommended;page for trump campaign/admin;keitholbermann jeff;jeff sessions recommended carter,"jeff sessions,carter page,carter,page,trump"
350,,8.52E+017,4/12/2017 0:33,Isn't he a fucking buffoon though?,,https://twitter.com/carney/status/851942259935367169,AFPiedmont,he,,,he a fucking buffoon though;a;he a;a fucking buffoon though;he a fucking,
351,Trumprussia,8.52E+017,4/12/2017 0:33,Carter Page news: Trump supporters now believe they have their proof.  now believe they have their proof.,"Carter Page,Trump;",,Bernie4People,"carter page,trump","carter page,trump",carter page news: trump,trump supporters now;page news;supporters now;now;have their proof,"carter page,carter,page,trump;"
352,,8.52E+017,4/12/2017 0:33,The 90-day warrant has been renewed more than once since it was issued  via @washingtonpost,,https://www.washingtonpost.com/world/national-security/fbi-obtained-fisa-warrant-to-monitor-former-trump-adviser-carter-page/2017/04/11/620192ea-1e0e-11e7-ad74-3a742a6e93a7_story.html?utm_term=.e4324b0208da,terri_to,,,,warrant has been renewed;washingtonpost;90-day warrant;warrant;the 90-day warrant,
