ID,HashTags,Tweet IDs,Time,TweetText,mentions_other,URL,User,calai_candidates,test_candidates,stanford_candidates,twiner_candidates,phase2_gt
353,,8.52E+017,4/12/2017 0:33,"@MrZeroF0 @LouiseMensch @counterchekist @level39 @conspirator0 @TeaPainUSA @MrFelt_ @FBI You refer to this i assume? 
",,https://twitter.com/i/web/status/851956361252540416,anathymadevice,fbi,,,level39 conspirator0;counterchekist level39 conspirator0;mrzerof0 louisemensch counterchekist level39 conspirator0;louisemensch counterchekist;this i assume,
354,,8.52E+017,4/12/2017 0:33,"July visit to Moscow approved by Trump camp:

","Moscow,Trump ",http://www.politico.com/story/2017/03/carter-page-russia-trip-trump-corey-lewandowski-235784,ekcj1234,"moscow,trump camp","moscow,trump camp","moscow,trump",to moscow;to;approved by trump camp;july visit to;july,"moscow,trump camp,trump"
355,DoubleStandards,8.52E+017,4/12/2017 0:33,"BUT HER EMAILS!  
FBI obtained FISA warrant to monitor former Trump adviser Carter Page
",";FBI,FISA,Trump,Carter Page",http://wapo.st/2pr7kpE,upanatm,"carter page,fbi,her,adviser,trump","fbi,trump,carter page","fbi,fisa,trump,carter page",her emails;but her;adviser carter page;fbi obtained;but her emails fbi obtained,";fbi,fisa,trump,carter page,carter,pag"
356,,8.52E+017,4/12/2017 0:33,"""Russia wants to avoid escalating the conflict at any cost, but is prepared 4 the worst"" 

(Sean Spicer Carter Page)","Russia;sean spicer,Carter Page",http://theduran.com/heres-why-russia-doesnt-want-to-fight-the-united-states-in-syria/,ClubBayern,"sean spicer carter page,russia","russia,spicer carter page",spicer carter page),to;to avoid escalating the;wants;sean spicer carter page;avoid escalating the,"russia;sean spicer, sean, spicer,carter page,carter,page"
357,"IToldYa, LoveYouObama",8.52E+017,4/12/2017 0:33,Carter Page is a spy  (Like we didn't already know)  he had that spy smile...,Carter Page,,Elvisnmore,"carter page,he,spy,a spy",carter page,carter page,smile;spy smile;page is;page is a spy;is,"carter page,carter,page"
358,,8.52E+017,4/12/2017 0:33,"Report: FISA court approved FBI's @Twitter, Look ≡ƒæÇ at Comey, Obama. Clinton, Even Military, NSA, FBI, Your answer!","FISA,FBI,Comey,Obama;Clinton,Military,NSA,FBI",http://www.washingtonexaminer.com/report-fisa-court-approved-fbis-request-to-spy-on-carter-page/article/2620046?utm_campaign=Washington%20Examiner:%20News%20From&utm_source=Washington%20Examiner:%20News%20From%20-%2004/11/17&utm_medium=email,MorvantCheryl,"clinton,fbi,fbi,fisa court,comey,twitter","fbi,comey,obama,clinton,nsa,fbi",,approved fbi twitter;court approved fbi twitter;fisa court approved fbi twitter;fbi your answer;fisa,"fisa,comey,obama;clinton,military,nsa,fbi,fisa court"
359,,8.52E+017,4/12/2017 0:33,Carter Page gets a cellmate!,Carter Page,https://twitter.com/funder/status/851956044603559938,RodneyAnon,carter page,carter page,carter page,gets a cellmate;carter page gets a cellmate;carter page gets;gets;page gets a cellmate,"carter page,carter,page"
360,,8.52E+017,4/12/2017 0:33,@funder Carter Page is such an unhinged person. Can believe I'm saying this but is this the best Russia could find?,Carter Page;Russia,,jacobsfam,"carter page,russia","carter page,russia",russia,funder;is such an;an;carter page;page is such an unhinged,"carter page,carter,page;russia"
361,,8.52E+017,4/12/2017 0:33,FBI reportedly probed ex-Trump aide Carter Page during campaign,"FBI,Carter Page",http://ow.ly/rABG50aNafp,zyiteblog,"aide,carter page,fbi,trump,carter page during",carter page,fbi,ex-trump;fbi reportedly;probed ex-trump;reportedly probed;probed,"fbi,carter page,carter,page"
362,Trumprussia,8.52E+017,4/12/2017 0:33,"Oh my. Look it's Carter Page, once again. FISA warrant because they believe he was/is a Russian agent.",";Carter Page;FISA,Russian",https://www.washingtonpost.com/amphtml/world/national-security/fbi-obtained-fisa-warrant-to-monitor-former-trump-adviser-carter-page/2017/04/11/620192ea-1e0e-11e7-ad74-3a742a6e93a7_story.html,MarkCM07,"carter page,he","carter page,russian",carter,it carter page;my;carter page;russian agent;was/is a russian agent,";carter page,carter,page;fisa,russian"
363,Maddow,8.52E+017,4/12/2017 0:33,Rachel  should do a special w/ all the planned segments that had to be tossed due to late-breaking Trump admin bombshells.,"Rachel,Trump",https://twitter.com/i/web/status/851956411819053059,lcgarbage,trump,"rachel,trump","rachel,trump",do a special w all;should do;a special w;should;bombshells,"rachel,trump"
364,,8.52E+017,4/12/2017 0:33,"THIS ≡ƒæç≡ƒÅ╜IS BIG!! Is anyone SURPRISED? 
IT IS PAST TIME FOR COMEY TO STEP DOWN...THEN THROW THE CUFFS ON HIM!",;;COMEY;,https://twitter.com/i/web/status/851956413555286016,DorH84607784,him,,comey,anyone;âis big is anyone surprised;â¡æã¦ã§â¡æã âis big;âis big is anyone;â¡æã¦ã§â¡æã,;;comey;
365,,8.52E+017,4/12/2017 0:33,"The most infuriating part is the FBI had all this info on Trump/Russian &amp; yet Comney's presser was about Hillary's old emails.
""Carter Page""","FBI,Trump,Russian,Comney,Hillary;Carter Page",,MJGWrites,"carter page,fbi,trump","fbi,trump/russian,hillary,carter page",fbi,infuriating part is the fbi;infuriating part;the most infuriating;carter page;emails carter page,"fbi,trump/russian,comney,hillary;carter page,carter,page"
366,,8.52E+017,4/12/2017 0:33,@CNN Maybe Spicer's Hitler comment was used to distract from FBI FISA &amp; Carter Page..Get everyone talking about it to bury FISA lede.....,"Spicer's,Hitler,FBI,FISA,Carter Page;FISA",,heartofstylez,"hitler,carter page,fbi,spicer","spicer,hitler,fbi,carter page","hitler,fbi,carter",cnn maybe;spicer;maybe spicer;hitler comment was used;to bury fisa lede,"spicer's,hitler,fbi,fisa,carter page,carter,page;fisa"
367,,8.52E+017,4/12/2017 0:33,Just like that,,https://twitter.com/JonathanLKrohn/status/851954248539656192,Joenewsguy,,,,like that;just like;just;like;that,
368,,8.52E+017,4/12/2017 0:33,@63ClarkS @jaketapper Oh!!  Let's talk about Carter Page!!,;Carter Page,,SalcidoKristin,carter page,carter page,carter page!!,63clarks;let;jaketapper oh let;carter page;oh,"carter page,carter,page"
369,,8.52E+017,4/12/2017 0:33,#NAME?,"FBI,FISA,Carter Page","http://MarketWatch.com, http://htl.li/xCDo50aNaCn",AnywhereNews,"carter page,fbi,adviser,trump","fbi,snoop,carter page","fbi,carter",to;fbi had;had fisa warrant to;had fisa;ex-trump adviser carter page report,"fbi,fisa,carter page,carter,page"
370,,8.52E+017,4/12/2017 0:33,"Hey, the U.S. has secret courts.
In case you need an example of ""normalization.""",;U.S.,https://twitter.com/washingtonpost/status/851936422751870977,ethomasw,u.s.,,u.s.,hey the;need an example of normalization;an example of normalization;hey;normalization,u.s.
371,"resist, TrumpRussia",8.52E+017,4/12/2017 0:33,Carter Page ...≡ƒÄ╝≡ƒÄñ and they all fall down!,Carter Page,,shannychick,carter page,carter page,,and;and they all fall down;carter page â¡æãââ¡æãã±;page â¡æãââ¡æãã± and;fall down,"carter page,carter,page"
372,,8.52E+017,4/12/2017 0:33,"""Carter Page"" living a America under this administration is like bad Tom Clancy novel.","Carter Page,America,Tom Clancy",,SOLOAMERICAN76,"america,carter page,tom clancy","carter page,america,tom clancy","america,tom clancy",page living a america;living a america under;living;tom clancy novel;a america,"carter page,carter,page,america,tom clancy"
373,,8.52E+017,4/12/2017 0:33,FBI had FISA warrant to snoop on ex-Trump adviser Carter Page: report: The FBI obtained a secretΓÇª  MARKETWATCH,"FBI,FISA,Carter Page,FBI",http://dlvr.it/NsY4P1,FinanzLinksCom,"carter page,fbi,fbi,adviser,trump","fbi,snoop,carter page,fbi","fbi,carter,fbi",fbi had;had fisa;warrant to snoop;fbi obtained a secretîãâª marketwatch;had fisa warrant to snoop,"fbi,fisa,carter page,carter,page,fbi"
374,,8.52E+017,4/12/2017 0:33,Last summer. Before the election. Before the whole October email announcement by Comey. This really is WRONG! HRC should be in the WH!,";;Comey;;HRC,WH",https://twitter.com/i/web/status/851956484527280128,iamhereinmich,comey,hrc,hrc,last;should be in the wh;be in the wh;before the;last summer before,";;comey;;hrc,wh"
375,,8.52E+017,4/12/2017 0:33,carter page all like hold my beverage,Carter Page,,LydiaBurrell,"carter page,beverage",carter page,,page all like;carter page;all like;like hold my beverage;my beverage,"carter page,carter,page"
376,,8.52E+017,4/12/2017 0:33,"Page is a link in a very complex chain. Still a link. Not ""the"" link.",Page;;,https://twitter.com/USARedOrchestra/status/851942261978005507,truth_trumpet,page,page,,a link in a;the link;link in;a link in;a,page;;
377,CarterPage,8.52E+017,4/12/2017 0:33,"@maddow Wonder if the Russian spies ever got borrowed millions to hook  as discussed in Complaint, and if so, how was it used?",Russian,https://twitter.com/i/web/status/851956502608969729,raquelgordon,,,,wonder;how was it used;it used;russian spies ever;so how was it used,russian
378,,8.52E+017,4/12/2017 0:33,SYRIA STUNT.  B.S. to distract from Russia  crimes.  TRUMP STILL BEING CRIMINALLY INVESTIGATED.  WAKE UP MSM.   ≡ƒì⌐≡ƒì┐≡ƒì⌐≡ƒì½,SYRIA;;Russia;TRUMP;MSM;,https://twitter.com/i/web/status/851956506849419264,bonecho5,"russia,syria,up msm","syria,russia","syria,russia",stunt b.s;b.s;stunt;stunt b.s to;stunt b.s to distract from,"syria,russia;trump;msm;"
379,,8.52E+017,4/12/2017 0:33,I know @FBI is trying to get all the spies and moles but before too much damage like nukes start using the handcuffs,,https://twitter.com/amy_siskind/status/851946192376401920,mwdeeth,fbi,,,nukes start using the handcuffs;trying to get;know;i know;is trying to get,
380,,8.52E+017,4/12/2017 0:33,You're a special flavor of stupid.,,https://twitter.com/carney/status/851942259935367169,sametownblues,,,,youre a;youre a special;a;special flavor of stupid;of stupid,
381,,8.52E+017,4/12/2017 0:33,Last summer FBI obtained FISA warrant to monitor former Trump adviser Carter Page,"FBI,FISA,Trump,Carter Page",https://www.washingtonpost.com/world/national-security/fbi-obtained-fisa-warrant-to-monitor-former-trump-adviser-carter-page/2017/04/11/620192ea-1e0e-11e7-ad74-3a742a6e93a7_story.html?utm_term=.4e78f262ae81&wpisrc=al_alert-COMBO-politics%252Bnation&wpmk=1,AndyMcCanse,"carter page,fbi,adviser,trump","fbi,trump,carter page","fbi,fisa,trump,carter page",last;adviser carter page;fbi obtained fisa;obtained fisa;carter page,"fbi,fisa,trump,carter page,carter,page"
382,,8.52E+017,4/12/2017 0:05,"I don't know if he can incriminate Trump, but this guy will flip quickly and sing like 387 birds:",Trump,,DavidKoechner,"he,trump",trump,,birds;sing like 387 birds;if he can;i dont know;know,trump
383,,8.52E+017,4/12/2017 0:33,Carter Page on the verge of being thrown under the bus so hard he'll wish he was flying on United:,"Carter Page,United",http://wapo.st/2pr7kpE?tid=ss_tw,robertcaruso,"carter page,he,he","carter page,united",carter page,verge of;was flying on united;on;on the verge of;carter page,"carter page,carter,page,united"
384,,8.52E+017,4/12/2017 0:33,BINGO! FBI obtained FISA warrant to monitor former Cheetolini adviser Carter Page,";FBI,FISA;Cheetolini,Carter Page",http://wapo.st/2pr7kpE?tid=ss_tw,RuPaul,"carter page,fbi,adviser","fbi,carter page","fbi,fisa,cheetolini,carter page",fbi obtained fisa warrant;bingo fbi obtained;adviser carter page;warrant;fbi obtained fisa,";fbi,fisa;cheetolini,carter page,carter,page"
385,,8.52E+017,4/12/2017 0:33,"FBI got FISA warrant to monitor former Trump adviser Carter Page - ""probable cause...acting as agent of [Russia]""","FBI,FISA,Trump,Carter Page,Russia",http://wapo.st/2pr7kpE?tid=ss_tw,EisOnMN,"carter page,fbi,russia,adviser,trump","trump,carter page,russia","fbi,fisa,trump",cause...acting as agent of russia;agent of russia;to monitor;got fisa warrant;as agent of russia,"fbi,fisa,trump,carter page,carter,page,russia"
386,,8.52E+017,4/12/2017 0:34," Carter Page was the target of Counter-terrorism probe &amp; investor in Rosneft, the Russia oil giant &amp; Trump advisor.","Carter Page,Rosneft,Russia,Russia oil,Trump",http://wapo.st/2pr7kpE,ClimateTalker,"advisor,carter page,russia,oil giant,rosneft","carter page,counter-terrorism,rosneft,russia","carter page,russia",amp trump advisor;the target of;carter page was;was;target of,"carter page,carter,page,rosneft,russia,russia oil,trump"
387,,8.52E+017,4/12/2017 0:34,@seanhannity @FoxNews @adamhousley @oreillyfactor @TuckerCarlson @SaraCarterDC FISA'S are highly classified so this is another illegal leak,FISA,https://twitter.com/i/web/status/851956531553816576,MyPlace4U,,,,tuckercarlson;adamhousley oreillyfactor tuckercarlson;adamhousley;seanhannity;this is another illegal leak,fisa
388,,8.52E+017,4/12/2017 0:34,"Comey/Nunez: But before you vote, we want to make sure you understand that duplicate Hillary emails that exonerate her have been discovered.","Comey,Nunez;Hillary",https://twitter.com/i/web/status/851956537438294016,leemwilliams,"comey,her",hillary,hillary,you vote we want;have been discovered;been discovered;discovered;comey/nunez but before,comey/nunez;hillary
389,,8.52E+017,4/12/2017 0:34,@DavidCornDC Wash Post breaking ... FISA warrant was issued for Carter Page by FBI,";FISA,Carter Page,FBI",,KarenBlumentha1,"carter page,fbi","carter page,fbi","@davidcorndc wash post,fbi",davidcorndc;davidcorndc wash post breaking fisa;page by fbi;post breaking fisa;fisa,";fisa,carter page,carter,page,fbi"
390,,8.52E+017,4/12/2017 0:34,"Watch @FoxNews work to distance Trump from this--Page is a former adviser NOW, but was on staff when FBI sought warrant.","Trump,Page,FBI",https://twitter.com/i/web/status/851956546602795008,TraylorAlan,"page,fbi,adviser,trump","trump,page","trump,fbi",trump;foxnews work;sought warrant;work to distance trump;warrant,"trump,page,fbi"
391,,8.52E+017,4/12/2017 0:34,I think these guys that sold out our country to the devil (Russia) should probably get a Darth Vader like body guard for protection.,"Russia,Darth Vader",https://twitter.com/i/web/status/851956551678140416,mhg1325,"russia,body guard for protection","russia,darth vader",,guys that sold out;these guys;for protection;i think these;out,"russia,darth vader"
392,,8.52E+017,4/12/2017 0:34,"Carter Page will be the primary witness for the prosecution, if he lives.",Carter Page,https://twitter.com/texyellowdogdem/status/851944103998885888,3drummers,"carter page,he",carter page,,page will;will be the;carter page;he lives;the prosecution if he lives,"carter page,carter,page"
393,,8.52E+017,4/12/2017 0:34,@mitchellvii What about Carter Page comrade?,Carter Page,,RealAlgerHiss,carter page,carter page comrade,carter page comrade?,what about carter;about;what about;about carter page comrade;mitchellvii what,"carter page,carter,page"
394,,8.52E+017,4/12/2017 0:34,Report: FBI Got FISA Warrant to Monitor Carter Page,"FBI,FISA,Carter Page",http://thebea.st/2o2ofxm,annehillebrand2,"carter page,fbi",carter page,"fbi,carter page",monitor carter page;fbi got fisa warrant;fbi got;report fbi;carter page,"fbi,fisa,carter page,carter,page"
395,,8.52E+017,4/12/2017 0:21,"Wait...Carter Page actually compared himself to MLK (re: FBI/Justice surveillance/eavesdropping)?

I'm gonna need aΓÇª",";Carter Page,MLK;",,Amy_Siskind,"carter page,fbi,wait",carter page,,page actually compared himself;page actually;wait...carter;actually;aîãâª,";carter page,carter,page,mlk;"
396,,8.52E+017,4/12/2017 0:34,"Oh carter page, look what you have done? I feel sorry for Syria now. Con man Don gonna rain tomahawk on them soon","Carter Page;Syria;Don,tomahawk",,huffingtonList,"carter page,syria,don","carter page,syria,don","syria,don",page look what you have;oh carter;look what you have;page look;carter page,"carter page,carter,page;syria;don,tomahawk"
397,,8.52E+017,4/12/2017 0:34,"Carter Page right now, probably.",Carter Page,,MariaLiaCalvo,carter page,carter page,carter page,now probably;carter page right now probably;carter page right;page right now probably;probably,"carter page,carter,page"
398,,8.52E+017,4/12/2017 0:34,I was going to write about hate and betrayal.  But the real story here is stupidity.,;,https://twitter.com/kentuckyshaunt/status/851949065751449601,GenKnoxx,,,,going;stupidity;was going;to write;write,;
399,,8.52E+017,4/12/2017 0:34,"Amidst the latest gaffe and questionable military tactics, let us not lose sight.",;,https://twitter.com/JuddLegum/status/851946015557079040,akimboh,,,,and;amidst;not lose sight;us not lose sight;let us not lose sight,;
400,Trumprussia,8.52E+017,4/12/2017 0:34,@realDonaldTrump @funder   The truth just keeps slowly trickling out!,,https://twitter.com/washingtonpost/status/851936422751870977,Nato_true_cons,,,,funder the truth just;realdonaldtrump;just keeps slowly trickling out;funder;truth,
401,,8.52E+017,4/12/2017 0:34,FoxNews: Carter Page: FBI reportedly obtained FISA warrant to monitor ex-Trump adviser,"FoxNews,Carter Page,FBI,FISA,",http://www.foxnews.com/politics/2017/04/11/carter-page-fbi-reportedly-obtained-fisa-warrant-to-monitor-ex-trump-adviser.html,newsjunkieswmo,"carter page,fbi,adviser,trump",carter page,"fbi,fisa",carter page fbi reportedly;page fbi reportedly;adviser;monitor ex-trump adviser;page fbi,"foxnews,carter page,carter,page,fbi,fisa,"
402,,8.52E+017,4/12/2017 0:14,More than that. The FBI believed there was probable cause that Page was acting as an agent of Russia.,"; FBI,Page,Russia",https://twitter.com/ddiamond/status/851946646787284993,tribelaw,"page,fbi,russia",russia,"fbi,page",than;agent of russia;fbi believed;more;an agent of russia,"; fbi,page,russia"
403,"hardball, inners",8.52E+017,4/12/2017 0:34,"Does this mean the worship of phallic symbols is over &amp; we're back to reality?
Carter Page
   @MikeMalloyShow",;Carter Page;,https://twitter.com/i/web/status/851956627200770049,wildweezle,carter page,carter page@mikemalloyshow,,does;to reality carter page mikemalloyshow;the worship of;this;carter page mikemalloyshow,";carter page,carter,page;"
404,,8.52E+017,4/12/2017 0:34,FBI obtained FISA warrant to monitor former Trump adviser Carter Page  When will he be arrested?,"FBI,FISA,Trump,Carter Page,",http://wapo.st/2pr7kpE?tid=ss_tw,Vidian6,"carter page,he,fbi,adviser,trump","fbi,trump,carter page","fbi,fisa,trump",arrested;to;he be arrested;to monitor;fbi obtained,"fbi,fisa,trump,carter page,carter,page,"
405,,8.52E+017,4/12/2017 0:34,Finally a Special Prosecutor is needed! Duh ya think?,;,https://twitter.com/tedlieu/status/851948388115337216,bugbuster55,a special prosecutor,,,finally a;needed duh ya think;special prosecutor;a special prosecutor;a,;
406,KS04,8.52E+017,4/12/2017 0:34," 
Sean Spicer/Holocaust 
Carter Page
Nunes 

BEING ON TWITTER NOW LIKE","sean spicer,Holocaust;Carter Page;Nunes;TWITTER",,SuchPolitics,"carter page,sean spicer,nunes,twitter","sean spicer/holocaustcarter,twitter",sean spicerholocaust carter page nunes,on twitter now like;spicer/holocaust carter page;spicer/holocaust carter page nunes;like;sean spicer/holocaust carter page,"sean spicer, sean, spicer,holocaust;carter page,carter,page;nunes;twitter"
407,,8.52E+017,4/12/2017 0:34,And don't forget... Susan Rice had every right to unmask names in those incidental collections because of this... right here.,;Susan Rice;,https://twitter.com/i/web/status/851956643722145793,chelsea_craft,susan rice,susan rice,susan rice,and;dont forget;susan rice had;dont forget susan;forget susan rice had,;susan rice;
408,,8.52E+017,4/12/2017 0:34,.@seanhannity and @marklevinshow &amp; others have lied about possible treason by Carter Page &amp; others. They're traitors for the obfuscation.,Carter Page;,https://twitter.com/i/web/status/851956645508784128,ColoradoHeathen,carter page,carter page,carter,and;and marklevinshow;and marklevinshow amp;seanhannity;obfuscation,"carter page,carter,page;"
409,,8.52E+017,4/12/2017 0:34,Former Trump Adviser Carter Page Was Being Monitored by FBI (Report),"Trump,Carter Page,FBI",https://goo.gl/kuLqs1,TheWrap,"carter page,fbi,adviser","carter page,fbi",fbi,trump;former trump adviser carter;adviser carter page;trump adviser;by fbi report,"trump,carter page,carter,page,fbi"
410,,8.52E+017,4/12/2017 0:34,Evidence MUST be presented to FISA judge showing probable criminality . . .,FISA,https://twitter.com/washingtonpost/status/851936422751870977,SteveBTI,fisa judge,fisa judge,,be presented to;be presented;judge showing probable criminality;fisa judge showing probable criminality;evidence,fisa
411,,8.52E+017,4/12/2017 0:34,"@JohnFugelsang In Soviet Russia, Page carts Carter around!","Soviet Russia,Page,Carter",,LREwoke,"page,russia","soviet russia,page,carter",carter,page carts carter around;carter around;russia page carts carter around;johnfugelsang;in soviet,"soviet russia,page,carter"
412,,8.52E+017,4/12/2017 0:34,You half twit,,https://twitter.com/carney/status/851942259935367169,himynameisaldo,,,,half twit;you half;half;you half twit;you,
413,,8.52E+017,4/12/2017 0:34,@mkhammer So this Carter Page revelation...should media tamp that one down to a nice 2 or 3?,Carter Page,,HT4Real,carter page,carter page,,page revelation...should;so this carter page revelation...should;3;2 or 3;revelation...should,"carter page,carter,page"
414,,8.52E+017,4/12/2017 0:34,"@Alyssa_Milano If Carter Page met the criterion for FISA warrant approval at his level, the others on Trump's team are officially screwed.","Carter Page,FISA,Trump",,KianuStarr,"carter page,his,milano,trump","carter page,trump","carter page,fisa",team are officially screwed;alyssa_milano if carter;if carter;officially screwed;screwed,"carter page,carter,page,fisa,trump"
415,,8.52E+017,4/12/2017 0:34,Did Carter Page have any dealings with Russia?,"Carter Page,Russia",,Miller_Hyatt,"carter page,russia","carter page,russia",carter page,carter page have;dealings with russia;did;did carter page;with russia,"carter page,carter,page,russia"
416,,8.52E+017,4/11/2017 23:22,"It's baaaaaackkkkk. Those tomahawk missiles could only delay things for so long.

",;tomahawk,https://www.washingtonpost.com/world/national-security/fbi-obtained-fisa-warrant-to-monitor-former-trump-adviser-carter-page/2017/04/11/620192ea-1e0e-11e7-ad74-3a742a6e93a7_story.html?utm_term=.1a1725c35e96&wpisrc=al_alert-COMBO-politics%252Bnation&wpmk=1,OscarNunezLA,,,,baaaaaackkkkk those;those tomahawk;baaaaaackkkkk those tomahawk;baaaaaackkkkk;things for so long,;tomahawk
417,Resistance,8.52E+017,4/12/2017 0:34,Education: Understanding the Carter Page story via @resistmanual,Carter Page,https://twitter.com/resistmanual/status/851955726314504192,resistdashboard,,carter page,,page story via resistmanual;understanding;via resistmanual;education;education understanding the,"carter page,carter,page"
418,,8.52E+017,4/12/2017 0:34,"@ischafer @TheRickWilson Got Barfy Cam here, too.",Barfy Cam,http://dailycaller.com/2017/03/03/exclusive-who-brought-carter-page-onto-the-trump-campaign/,ChristinLuvsSno,,cam,,too;got barfy;cam here too;ischafer therickwilson;got barfy cam here too,barfy cam
419,,8.52E+017,4/12/2017 0:34,Ruh roh.  Thats right sessions brought him in the loop. Wonder what they have on sessions?,;sessions;;sessions,https://twitter.com/zac_petkanas/status/851955838185070592,HiMaui,him,,ruh,have on sessions;roh;thats right sessions brought;ruh roh;ruh,;sessions;;sessions
420,,8.52E+017,4/12/2017 0:34,@AshLadBlog good times.,,https://twitter.com/rexhuppke/status/851938649298042881,ChicagoAli,,,,ashladblog;ashladblog good;times;good;good times,
421,ThiefJusticeGorsuch,8.52E+017,4/12/2017 0:34,WTF did Senate push thru 's nomination with this mess hanging over Trump? Oh yeah. Roe v. Wade.,"Senate,Trump;;Roe v. Wade",https://www.washingtonpost.com/world/national-security/fbi-obtained-fisa-warrant-to-monitor-former-trump-adviser-carter-page/2017/04/11/620192ea-1e0e-11e7-ad74-3a742a6e93a7_story.html?utm_term=.fd858b758fa8,AynAyahSteenkur,"roe v. wade,senate,trump","senate,trump,wade","wtf,senate",wtf did;v wade;push thru s;thru s;did,"senate,trump;roe v. wade"
422,,8.52E+017,4/12/2017 0:34,Did I miss something on the calendar?? Is it national Foot-In-Mouth day? Or Stomp-On-History month??,;;,https://twitter.com/jonathanlkrohn/status/851954248539656192,kimijtoo,,,,day or stomp-on-history month;month;on;did;miss,;;
423,,8.52E+017,4/12/2017 0:34,@TheCartelMatt FBI  HRC's Andrew McCabe was secretly working with  Lynch/Obama/Rice to spy on Donald Trump team VIA any means necessary!  Carter Page,"FBI,HRC,Andrew McCabe,Lynch,Obama,Rice,Trump, Donald Trump;Carter Page",https://twitter.com/i/web/status/851956741394837504,glennyork,"carter page,fbi,andrew mccabe,donald trump","hrc,andrew mccabe,donald trump,carter page","fbi,andrew mccabe,donald trump",hrc andrew mccabe was secretly;fbi hrc;mccabe was secretly;necessary carter page;carter page,"fbi,hrc,andrew mccabe,lynch/obama/rice,trump, donald trump;carter page,carter,page"
424,,8.52E+017,4/12/2017 0:34,The real story - FBI obtained FISA warrant to monitor former Trump adviser Carter Page,"FBI,FISA,Trump,Carter Page",https://www.washingtonpost.com/world/national-security/fbi-obtained-fisa-warrant-to-monitor-former-trump-adviser-carter-page/2017/04/11/620192ea-1e0e-11e7-ad74-3a742a6e93a7_story.html,HariNarayanKris,"carter page,fbi,adviser,trump","the real story,fbi,trump,carter page","fbi,fisa,trump,carter page",real;adviser carter page;the real;fbi obtained;real story fbi obtained,"fbi,fisa,trump,carter page,carter,page"
425,,8.52E+017,4/12/2017 0:34,Dear @presssec and @realdonaldtrump. Remember that Trump himself told the Washington Post that Carter Page is an advisor. Put a pin in that.,";Trump,Washington Post,Carter Page;",,GinoKusa,"carter page,the washington post,an advisor,trump","washington post,carter page","trump,washington post,carter page",trump;and;dear;presssec;pin in that,";trump,washington post,carter page,carter,page;"
