ID,HashTags,Tweet IDs,Time,TweetText,mentions_other,URL,User,calai_candidates,test_candidates,stanford_candidates,twiner_candidates,phase2_gt
149,TrumpRussia,8.52E+017,4/12/2017 0:28,"Carter Page had other contacts with Russian operatives that have not been publicly disclosed.
 

","Carter Page,Russian;",https://www.washingtonpost.com/world/national-security/fbi-obtained-fisa-warrant-to-monitor-former-trump-adviser-carter-page/2017/04/11/620192ea-1e0e-11e7-ad74-3a742a6e93a7_story.html,JebBoosh,carter page,"carter page,russian",carter page,other contacts;carter page had other contacts;had other contacts;carter page;not been publicly disclosed,"carter page,carter,page,russian"
150,,8.52E+017,4/12/2017 0:28,GOP and DEM,"GOP,DEM",https://twitter.com/stockmonsterusa/status/851952144550723584,tiwhitter,"gop,dem",dem,gop,and;dem;gop and dem;and dem;gop,"gop,dem"
151,,8.52E+017,4/12/2017 0:28,@Reuters Besides Carter Page acting as a foreign agent there has to be alot more in the WH.,"Carter Page,WH",,gs619usmc,carter page,carter page,carter page,besides;page acting as;carter page acting as;reuters besides;besides carter page acting as,"carter page,carter,page,wh"
152,,8.52E+017,4/12/2017 0:28,"Comey is a POS. Major press event with Weiner email, but he KNEW about FISA warrant. Did it anyway, knowing the result would help tRump.","Comey;Weiner,FISA;tRump",https://twitter.com/i/web/status/851955264345432064,truth_trumpet,"fisa,he,comey",fisa,"comey,weiner",comey is;result would help trump;comey;a;is a,"comey;weiner,fisa;trump"
153,,8.52E+017,4/12/2017 0:29,What a tangled web they weave... I'm so grateful for our Intel community and FBI who will untangle all of it and lock them up!,;FBI,https://twitter.com/i/web/status/851955277876404225,notherringfarts,"fbi,tangled web,intel",fbi,"intel,fbi",tangled web;a;and lock them up;a tangled;it and lock them up,;fbi
154,AllColluded,8.52E+017,4/12/2017 0:29,@maddow Seems Carter Page drew the short straw. Trump &amp; Co. offering up Page to FBI to take the blame for Russian interference.,"Carter Page;Trump,Page,FBI,Russian",,Aneetchkoo,"carter page,fbi","carter page,russian","carter page,trump &amp; co.,fbi",seems carter;for russian interference;drew the short;short;blame for russian interference,"carter page,carter,page;trump,page,fbi,russian"
155,Fiverr,8.52E+017,4/12/2017 0:29,Check this out! I will do computer networking and IT security on   Sean Spicer Carter Page,";sean spicer,Carter Page",https://www.fiverr.com/s2/887fdf0321,newton_engineer,sean spicer carter page,sean spicer carter,sean spicer carter page,out i will;out;this;will do;out i will do,"sean spicer, sean, spicer,carter page,carter,page"
156,,8.52E+017,4/12/2017 0:29,@DoctorPeterD @thehill We have seen what happens. Carter Page was unmasked (it's in the press) and all signs point toward the former administration. 1/2,;Carter Page;,https://twitter.com/i/web/status/851955289234563072,TespGames,"former administration,carter page",carter page,carter page,former administration 1/2;the former administration 1/2;administration 1/2;doctorpeterd thehill we;have seen what happens,"carter page,carter,page;"
157,,8.52E+017,4/12/2017 0:01,Warrant on Carter Page shows we no longer have smoke. We have extreme heat. Acting Atty General must appoint a SpecΓÇª,Carter Page;;Acting Atty General,,MichaelCastner,"carter page,acting atty general","carter page,atty general",,on carter;carter page shows we;shows we;warrant;page shows we,"carter page,carter,page;;acting atty general"
158,funder,8.52E+017,4/12/2017 0:29,BREAKING: FBI obtained FISA warrant to monitor former Trump adviser Carter Page  by  via @c0nvey,"FBI,FISA,Trump,Carter Page",http://ln.is/kRTP8,susan_dover,"fisa,carter page,fbi,adviser","fbi,trump,carter page","fbi,fisa,trump",fbi obtained fisa warrant;page by via c0nvey;carter page by via c0nvey;warrant;breaking fbi,"fbi,fisa;trump,carter page,carter,page"
159,,8.52E+017,4/12/2017 0:29,"March 2016:

",,https://www.bloomberg.com/politics/articles/2016-03-30/trump-russia-adviser-carter-page-interview,ekcj1234,,,,march;2016;march 2016,
160,,8.52E+017,4/12/2017 0:29,@cnnbrk @Evan_McMullin Good Lord how many scandals can Trump  et al generate in a day? Carter Page FISA story and now this,"Trump;Carter Page,FISA",,GirlOnFireSally,"fisa,carter page","good lord,carter page",trump,evan_mcmullin good;evan_mcmullin;good lord how many scandals;and now this;cnnbrk evan_mcmullin good,"trump;carter page,carter,page,fisa"
161,trumprussia,8.52E+017,4/12/2017 0:29,Carter  fbi warrant,"Carter,fbi",https://twitter.com/sarahkendzior/status/851937359155298305,lsfarmer311,"carter,fbi",carter,carter,fbi warrant;carter fbi;warrant;fbi;carter,"carter,fbi,fbi warrant"
162,,8.52E+017,4/12/2017 0:29,"Place you bets, I say @realDonaldTrump will be out of office in next 12 months And @mike_pence needs to follow him too  ""Carter Page""",Carter Page,,Itsafairday,"carter page,him","office,carter page",,bets i say realdonaldtrump will;say realdonaldtrump will;i say realdonaldtrump will;follow him too carter page;you bets,"carter page,carter,page"
163,"Trumprussia, TrumpRussiaCollusion, russiagate",8.52E+017,4/12/2017 0:29,"  
 I remember his shit eating grin when Chris Hayes was interviewing him on",Chris Hayes,https://twitter.com/i/web/status/851955341138870276,RWTrollPatrol,"him,his,chris hayes",chris hayes,chris hayes,his shit eating;interviewing him on;him on;his;i remember his shit eating,chris hayes
164,,8.52E+017,4/12/2017 0:29,Almost a year later the Carter Page FISA news drops and this is BIG news? (Sarcasm) Dems working overtime to blow it up!,"Carter Page,FISA;Dems",,TheLabeler5000,"the carter page fisa news,fisa","carter page,dems",,a year;a;the carter page;overtime to blow it up;almost,"carter page,carter,page,fisa;dems"
165,TrumpRussia,8.52E+017,4/12/2017 0:29,"One of the two presidential candidates was under FBI investigation on Election Day, &amp; it wasnt Hillary Clinton.  Carter Page","FBI,Election Day,hillary,Hillary Clinton;Carter Page",,PunchTrumpUS,"hillary clinton,carter page,fbi","election day,hillary clinton,carter page","fbi,hillary clinton. carter page",one of;of the two;of the;the two presidential candidates was;the two presidential candidates,"fbi,election day,hillary,hillary clinton;carter page,carter,page"
166,,8.52E+017,4/12/2017 0:29,"@FBI BUT WENT AFTER HRC, NOW WE HAVE A LUNATIC IN THE WHITE HOUSE AND U HAVE BIG RESPONSIBILITY FOR THIS",HRC,https://twitter.com/kylegriffin1/status/851937089415516160,PamBattistella,"fbi,white house",white house,white house,but went;went;but went after;this;now,hrc
167,,8.52E+017,4/12/2017 0:29,FBI obtained FISA warrant to monitor former Trump adviser Carter Page makes Comey's subsequent actions all the more unfathomable.,"FBI,FISA,Trump,Carter Page,Comey",,PunchTrumpUS,"fisa,carter page,fbi,comey,adviser","fbi,trump,carter page","fbi,fisa,trump",all the more unfathomable;fisa warrant to monitor former;to monitor;obtained fisa warrant to monitor;fbi obtained fisa,"fbi,fisa,trump,carter page,carter,page,comey"
168,Russian,8.52E+017,4/12/2017 0:29,"Carter Page, Former Trump Adviser, Monitored Last Summer By FBI Over  Contacts
","Carter Page,Trump,FBI","http://ift.tt/2o4j29g, https://twitter.com/i/web/status/851954267594178560",livechannelfeed,"monitored last,carter page,fbi,adviser","carter page,fbi","carter,fbi",trump;adviser;over contacts;page former trump adviser;former trump,"carter page,carter,page,trump,fbi"
169,,8.52E+017,4/12/2017 0:29,this one is a real page turner,,https://twitter.com/maggieNYT/status/851936962533629952,IamConiglio,,,,this one is;one is;page turner;is a real page turner;turner,
170,trumpRussia,8.52E+017,4/12/2017 0:29,@SenateGOP @washingtonpost  featured in a different WAPO article,WAPO,https://www.washingtonpost.com/world/national-security/fbi-obtained-fisa-warrant-to-monitor-former-trump-adviser-carter-page/2017/04/11/620192ea-1e0e-11e7-ad74-3a742a6e93a7_story.html?utm_term=.3774235122ec,Ban_Pres_Bannon,,,,washingtonpost;senategop;senategop washingtonpost featured;in a different wapo article;article,wapo
171,,8.52E+017,4/12/2017 0:29,"News of FISA Warrant against Carter Page, continuing silence on Flynn, fits inference they've nailed Trump. From 4/4","FISA,Carter Page,Flynn,Trump;",,KeithOlbermann,"fisa,carter page,flynn","carter page,flynn,trump",carter,trump from 4/4;fisa warrant against carter;from 4/4;theyve nailed trump from 4/4;fisa,"fisa,carter page,carter,page,flynn,trump;"
172,,8.52E+017,4/12/2017 0:29,"The Obama administration used the national security intelligence apparatus against its political enemies, because the IRS wasn't enough.","Obama,IRS",https://twitter.com/i/web/status/851955361712144385,lheal,"irs,national security intelligence,obama administration",,"obama,irs",administration;obama;the obama;the national;the irs wasnt enough,"obama,irs"
173,,8.52E+017,4/12/2017 0:29,"United Airlines thanks Carter Page, Devin Nunes and most importantly Sean Spicer","United Airlines,Carter Page,Devin Nunes,sean spicer",,sabrinasingh24,"carter page,sean spicer,devin nunes","united airlines,carter page,devin nunes,sean spicer","united airlines,carter,devin nunes,sean spicer",airlines;and most importantly sean spicer;spicer;most importantly sean spicer;airlines thanks,"united,united airlines,carter page,carter,page,nunes,devin nunes,sean spicer, sean, spicer"
174,,8.52E+017,4/12/2017 0:29,I know you are not trying to say Trump was right about illegal wiretapping by PBO. Worst spin of a legal FISA warrant by FBI.... ever.,"Trump,PBO;FISA,FBI;",https://twitter.com/i/web/status/851955365868601344,upsnodowns,"fisa,fbi","trump,pbo,fbi",trump,to;are not trying to;know;you are;know you are,"trump;fisa,fbi;"
175,,8.52E+017,4/12/2017 0:29,But her eemmmaaaaiiiiiiiiilllllllllllsssssssssssssssssssssssssssssssssssssssssssssssssssssssssssssssssssssssssssssss,,https://www.washingtonpost.com/world/national-security/fbi-obtained-fisa-warrant-to-monitor-former-trump-adviser-carter-page/2017/04/11/620192ea-1e0e-11e7-ad74-3a742a6e93a7_story.html,RSWestmoreland,her,,,her eemmmaaaaiiiiiiiiilllllllllllsssssssssssssssssssssssssssssssssssssssssssssssssssssssssssssssssssssssssssssss;but her;eemmmaaaaiiiiiiiiilllllllllllsssssssssssssssssssssssssssssssssssssssssssssssssssssssssssssssssssssssssssssss;but her eemmmaaaaiiiiiiiiilllllllllllsssssssssssssssssssssssssssssssssssssssssssssssssssssssssssssssssssssssssssssss;her,
176,,8.52E+017,4/12/2017 0:29,TRUMPLAND TODAY Sean Spicer says Hitler didn't gas anyone. Carter Page says FBI surveillance of him is like spying on Martin Luther King,"TRUMPLAND,sean spicer,Hitler;Carter Page,FBI,Martin Luther King",https://twitter.com/i/web/status/851955367458328578,joesentme,"luther king,hitler,carter page,him,fbi,sean spicer","sean spicer,hitler,carter page,fbi,martin luther","sean spicer,hitler,fbi,martin luther king",sean spicer says hitler didnt;spying on martin luther king;sean spicer;trumpland today sean;says hitler didnt,"trumpland,sean spicer, sean, spicer,hitler;carter page,carter,page,fbi,martin luther king"
177,,8.52E+017,4/12/2017 0:29,NOT breaking- (to those of us paying attention ) thanks to @LouiseMensch,,https://twitter.com/abbydphillip/status/851936736330559488,sahmiya_says_GO,,,,breaking to those;to those;not breaking to those;attention thanks to louisemensch;to louisemensch,
178,,8.52E+017,4/12/2017 0:29,"But those @HillaryClinton emails........(looking for ""head exploding"" emoji)",,https://twitter.com/carlzimmer/status/851953693771669505,Aiims1742,,,,hillaryclinton emails........(looking;emails........(looking for head exploding emoji;emoji;but those;but those hillaryclinton,
179,,8.52E+017,4/12/2017 0:29,"I created this Tease for ""carter page"" using T. Go to  to create &amp; share a Tease for any topic.",Carter Page,"http://rftgyc.com, https://twitter.com/i/web/status/851955383782457344",TipTop_News,carter page,carter page,,a tease for any topic;for carter;this tease for carter page;topic;created this tease,"carter page,carter,page"
180,,8.52E+017,4/12/2017 0:29,It's like they don't get that what's been confirmed here is that there is major evidence of collusion.,,https://twitter.com/carney/status/851942259935367169,IsobelCarr,,,,they;it like;is major evidence of collusion;evidence of collusion;like they dont get that,
181,,8.52E+017,4/12/2017 0:29,"Will someone tell the MSM? Oh yeah, they already know.",MSM;,https://twitter.com/carney/status/851942259935367169,RedStateRule,,,,someone;will someone;they already know;yeah they already know;tell the,msm;
182,,8.52E+017,4/12/2017 0:29,The FBI obtained a warrant to monitor former Trump adviser Carter Page.,"FBI,Trump,Carter Page",http://bos.gl/LNJlDgd,BostonGlobe,"carter page,fbi,adviser","fbi,trump,carter page","fbi,trump,carter page.",a;adviser carter page;obtained a warrant;a warrant;warrant,"fbi,trump,carter page,carter,page"
183,,8.52E+017,4/12/2017 0:29,@matt_rawlik here's those FISA's we were talking about,FISA,https://twitter.com/KeithOlbermann/status/851949276703981568,ARaw45,fisa,,,were talking about;about;talking about;fisa;we were talking about,fisa
184,,8.52E+017,4/12/2017 0:29,"@AAANYC1 @M2324M @THXOne138 @cnnbrk Maybe you prefer the word of @Sebastiangorka, or Carter Page, Manafort, or Tillerson. Nothing to see comrade.","Carter Page,Manafort,Tillerson;",https://twitter.com/i/web/status/851955407421677568,MssAnthrope,carter page,carter page,,thxone138 cnnbrk maybe you;to see comrade;cnnbrk maybe you;maybe you prefer;see comrade,"carter page,carter,page,manafort,tillerson;"
185,,8.52E+017,4/12/2017 0:29,@ResistanceParty Oh is this the oil industry consultant Carter Page?? &amp; Who pray tell recommended him??,;,,AssHrdRndWorld,"who,the oil industry consultant,oil,carter page,him",carter page,carter,oh is;is this the;resistanceparty;who pray tell recommended him;is,;
186,SDLive,8.52E+017,4/12/2017 0:29,"Washington Post app download 

  Carter Page",Washington Post;Carter Page,http://play.google.com/store/apps/details?id=r.s.s.washingtonpost,googleplay_aps,"carter page,washington post",washington post,"washington post,carter page",app;washington;download carter page;post app;carter page,"washington post;carter page,carter,page"
187,,8.52E+017,4/12/2017 0:29,CEO of Russia Oil offered Trump adviser he felt deal to get US sanctions lifted:,"CEO,Russia,Russia Oil,Trump,US",http://www.businessinsider.com/carter-page-trump-russia-igor-sechin-dossier-2017-1,JC12Tx,"russia oil,he,ceo,us,adviser","russia,trump","russia,trump,us",lifted;offered;russia oil offered;ceo of;of russia oil offered,"ceo,russia,russia oil,trump,us"
188,,8.52E+017,4/12/2017 0:29,"So...either Trump was duped or was complicit

",Trump,https://www.washingtonpost.com/amphtml/world/national-security/fbi-obtained-fisa-warrant-to-monitor-former-trump-adviser-carter-page/2017/04/11/620192ea-1e0e-11e7-ad74-3a742a6e93a7_story.html,SC_Ropp,,trump,trump,was duped or was complicit;trump;was complicit;complicit;was,trump
189,,8.52E+017,4/12/2017 0:29,quel surprise!    FBI obtained FISA warrant to monitor former Trump adviser Carter Page,";FBI,FISA,Trump,Carter Page",http://wapo.st/2pr7kpE?tid=ss_tw,pattirmuller,"fisa,carter page,fbi,adviser","fbi,trump,carter page","fbi,fisa,trump,carter page",surprise fbi obtained fisa;quel surprise fbi obtained fisa;quel surprise;surprise;adviser carter page,";fbi,fisa,trump,carter page,carter,page"
190,,8.52E+017,4/12/2017 0:29,Why didnt FBI annouce that investigation,FBI,https://twitter.com/ddiamond/status/851946646787284993,razzberry1947,fbi,,fbi,why;fbi annouce that investigation;didnt fbi annouce that investigation;didnt fbi;why didnt fbi,fbi
191,,8.52E+017,4/12/2017 0:29,This may be awkward....,,https://twitter.com/jimmurrayii/status/851941290870583296,LetsTrekSpain,,,,may be;this;may;awkward;be awkward,
192,inners,8.52E+017,4/12/2017 0:29,"Relieved that Trump only surrounds himself with the best people-the best people with Russian ties: Carter Page,Flynn,Manafort...
","Trump,Russian,Carter Page,Flynn,Manafort",,ChiOneToo,"carter page,flynn","trump,russian,carter page,flynn,manafort","trump,carter","russian ties carter page,flynn,manafort;trump;ties carter page,flynn,manafort;surrounds himself;that trump only surrounds himself","trump,russian,carter page,carter,page,flynn,manafort"
193,"Trumprussia, russiagate",8.52E+017,4/12/2017 0:29,Carter Page under investigation for suspicious Russian ties,"Carter Page,Russian",https://twitter.com/washingtonpost/status/851936422751870977,lfbensimon,carter page,"carter page,suspicious russian",carter page,page under investigation;under investigation;carter page under;investigation for suspicious russian ties;suspicious russian ties,"carter page,carter,page,russian"
194,,8.52E+017,4/12/2017 0:29,So the second domino falls - who gets the best deal??? Hope they took his passport,;,https://twitter.com/funder/status/851954007383920640,jprah1,his,,,they took his passport;the second;passport;so the second;second,
195,russiagate,8.52E+017,4/12/2017 0:29,"Think @maddow will be telling the ""Carter Page to Russia with Love"" story tonight?","Carter Page,Russia",,Storeees,"carter page,russia","carter page,russia with love",russia,be telling;maddow will be telling;will be telling;telling;maddow will,"carter page,carter,page,russia"
196,,8.52E+017,4/12/2017 0:29,"@realDonaldTrump Yep, Carter Page was being survield. FISA warrent issued, you asked Russia to find 30K @HillaryClinton emails hose coming","Carter Page;FISA,Russia",,EHines44,"fisa,carter page,russia","carter page,russia","carter page,russia",coming;page was being;realdonaldtrump;realdonaldtrump yep;yep carter page,"carter page,carter,page;fisa,russia"
197,,8.52E+017,4/12/2017 0:29,The FBI don't drop a dime until its time.,FBI;,https://twitter.com/mcspocky/status/851952998616006657,ScamGoggles,fbi,,fbi,dont drop;fbi dont;until its time;time;fbi dont drop,fbi;
198,bfd,8.52E+017,4/12/2017 0:29,A freaking .,,https://twitter.com/normative/status/851938384541044738,rachelvalentine,,,,a;freaking;a freaking,
199,,8.52E+017,4/12/2017 0:29,@washingtonpost Carter Page is despicable.,Carter Page,,Lorrenitram,carter page,carter page,,washingtonpost;is despicable;despicable;carter page is despicable;washingtonpost carter,"carter page,carter,page"
200,,8.52E+017,4/12/2017 0:29,Our incompetent lazy MSM is always late to the party  @LouiseMensch @MelissaJPeltier @RVAwonk,MSM,https://twitter.com/Ralfoo7/status/851955207307235328,Ralfoo7,@louisemensch @melissajpeltier @rvawonk,msm,msm,the party louisemensch melissajpeltier rvawonk;melissajpeltier rvawonk;lazy msm is;our incompetent;incompetent lazy msm is,msm
201,,8.52E+017,4/12/2017 0:29,"@AAANYC1 @M2324M @THXOne138 @cnnbrk Like this, you mean?",,http://thehill.com/policy/cybersecurity/328399-report-fbi-granted-fisa-warrant-to-surveil-ex-trump-aide-carter-page,PhysicalPolitik,,,,you mean;cnnbrk like this you mean;aaanyc1 m2324m;cnnbrk;thxone138 cnnbrk,
202,,8.52E+017,4/12/2017 0:29,Carter Page: FBI reportedly obtained FISA warrant to monitor ex-Trump adviser,"Carter Page,FBI,FISA,",http://www.foxnews.com/politics/2017/04/11/carter-page-fbi-reportedly-obtained-fisa-warrant-to-monitor-ex-trump-adviser.html,FoxNews,"fisa,carter page,fbi,adviser",carter page,"carter,fbi,fisa",carter page fbi reportedly;page fbi reportedly;adviser;fbi reportedly;page fbi,"carter page,carter,page,fbi,fisa,"
203,CarterPage,8.52E+017,4/12/2017 0:29,.@KeithOlbermann - In one of vids he said to keep an eye on . Good call!,;,https://twitter.com/tedlieu/status/851948388115337216,DinoRamirez72,he,,,keitholbermann in;in one of vids;vids;one of vids he;in one,
204,,8.52E+017,4/12/2017 0:29,This is like the Warriors claiming they won back to back championships...,Warriors,https://twitter.com/carney/status/851942259935367169,FrankChow,,the warriors,,the warriors;like the;like the warriors;this is like;to back championships,warriors
205,"CarterPage, TrumpRussia",8.52E+017,4/12/2017 0:29,"Recruited as a spy by Russia, foreign policy advisor  being investigated as part of  case.",Russia,https://www.washingtonpost.com/world/national-security/fbi-obtained-fisa-warrant-to-monitor-former-trump-adviser-carter-page/2017/04/11/620192ea-1e0e-11e7-ad74-3a742a6e93a7_story.html?tid=ss_tw&utm_term=.9b50fa3efd5b,McSaddle,"a spy,russia,foreign policy advisor",russia,,of case;as a spy by;a;a spy by;spy by,russia
206,,8.52E+017,4/12/2017 0:29,I will not spend the night reading about Trump I will not spend the night reading about Trump I will not spend the night reading about Trump,"trump,trump,trump",https://twitter.com/i/web/status/851955516934950912,moonlighthalo,,"trump,trump","trump,trump,trump",trump;the night reading about;will not spend;not spend;spend the night reading,"trump,trump,trump"
207,,8.52E+017,4/12/2017 0:29,"&amp; for those Breitbarters thinking this is proof of untoward surveillance?If there's a finding that Page WAS a foreign agent, Trump is toast","Breitbarters;Page,Trump",https://twitter.com/i/web/status/851955520651112449,tummler10,,trump,trump,toast;breitbarters thinking this is;foreign agent trump is toast;those breitbarters thinking this is;is,"breitbarters;page,trump"
208,Trump,8.52E+017,4/12/2017 0:29,FBI obtained FISA warrant to monitor former Trump adviser Carter Page - The Washington Post. Fish Rots from,"FBI,FISA,Trump,Carter Page,Washington Post;",https://apple.news/AmhlIgr5lSp2IJH895iS7QA,MorrisonRP,"fisa,carter page,fbi,adviser,the washington post","fbi,trump,carter page,the washington post","fbi,fisa,trump,washington",post fish rots from;to monitor;fish rots from;obtained fisa warrant to monitor;fbi obtained,"fbi,fisa,trump,carter page,carter,page,washington post;"
209,,8.52E+017,4/12/2017 0:30,"@USARedOrchestra  Yes, and just a few weeks ago DJT was tripping over himself distancing from Carter Page. Now we know why.","DJT,Carter Page;",,sonjastahlhut,carter page,carter page,carter,why;and;we know why;yes and;yes,"djt,carter page,carter,page;"
210,,8.52E+017,4/12/2017 0:30,trump is now original classifying authority right &amp; can just unilaterally declassify anything he wants. carter page,"trump,Carter Page",http://edition.cnn.com/2017/04/11/politics/intelligence-contradicts-nunes-unmasking-claims/index.html,nvrqt,"carter page,he","trump,carter page",,trump;now original classifying authority;wants carter page;now;is,"trump,carter page,carter,page"
211,,8.52E+017,4/12/2017 0:30,AND then there is this... Proof that Susan Rice had every legal right to unmask names under Obama's term &amp; we owe them TY for protecting USA,";Susan Rice,Obama,USA",https://twitter.com/i/web/status/851955533921882113,chelsea_craft,"susan rice,usa","susan rice,obama,usa","susan rice,usa",and;there is;this proof that susan;them ty for protecting usa;there,";susan rice,obama,usa"
212,"SDLive, OffendEveryoneIn4Words, BGC17",8.52E+017,4/12/2017 0:30,"Top 5:
1: Sean Spicer
2:  +9
3: Carter Page -1
4: 
5:  +6",;sean spicer;;Carter Page;;,,Trends5USA,"carter page,spicer,sean","sean spicer2,carter page",sean spicer,1 sean spicer 2;spicer;sean spicer;top 5 1 sean spicer;1,";sean spicer, sean, spicer;;carter page,carter,page;;"
213,,8.52E+017,4/12/2017 0:30,"Also, WaPo reporting on a FISA warrant last year that's now part of the Russia investigation:","WaPo,FISA,Russia",https://www.washingtonpost.com/world/national-security/fbi-obtained-fisa-warrant-to-monitor-former-trump-adviser-carter-page/2017/04/11/620192ea-1e0e-11e7-ad74-3a742a6e93a7_story.html?utm_term=.b8a262e7a8da,RamCNN,"fisa,russia","wapo,russia","wapo,russia",a;wapo;reporting;also;reporting on a fisa,"wapo,fisa,russia"
214,,8.52E+017,4/12/2017 0:30,And now here's something you'll really enjoy!,,https://twitter.com/washingtonpost/status/851936422751870977,rongiordan,,,,and;enjoy;and now;here something;now,
215,,8.52E+017,4/12/2017 0:30,"WP report that FISA court believed Carter Page was acting as Foreign Agent of the Russians,""an operative posing as a diplomat""","WP,FISA,Carter Page,Foreign Agent,Russians",https://twitter.com/i/web/status/851955547469492224,foreignpolicy77,"carter page,fisa court,a diplomat",carter page,carter page,as a diplomat;report that fisa;that fisa court believed carter;a diplomat;believed,"wp,fisa,carter page,carter,page,foreign agent,russians"
216,"SDLive, BGC17, TheFosters",8.52E+017,4/12/2017 0:30,Russia Warns Of Serious Consequences From U.S. Strike In Syria  Sean Spicer  Carter Page,"Russia,U.S. Strike,Syria,sean spicer,Carter Page",http://oscrape.com/p/191150,Officialoscrape,"sean spicer  carter page,russia,u.s.","russia,u.s. strike,syria sean spicer carter","russia,u.s.,syria sean spicer carter page",sean spicer carter page;serious consequences;consequences;russia warns of serious consequences;syria sean spicer carter page,"russia,u.s. strike,syria,sean spicer, sean, spicer,carter page,carter,page"
217,,8.52E+017,4/12/2017 0:30,WashPo: Judge approved FBI request to monitor Trump aide Carter Page,"FBI,Trump,Carter Page",http://www.dailykos.com/story/2017/4/11/1652370/-WashPo-Judge-approved-FBI-request-to-monitor-Trump-aide-Carter-Page,wvjoe911,"aide,carter page,fbi,judge","trump,carter page","fbi,trump,carter page",monitor trump aide carter page;judge approved fbi request;trump aide carter page;approved fbi request;judge,"fbi,trump,carter page,carter,page"
218,,8.52E+017,4/12/2017 0:30,"FBI showed probable cause that Trump associate Carter Page was acting as an agent of foreign power, Russia.","FBI,Trump,Carter Page,Russia",https://www.washingtonpost.com/world/national-security/fbi-obtained-fisa-warrant-to-monitor-former-trump-adviser-carter-page/2017/04/11/620192ea-1e0e-11e7-ad74-3a742a6e93a7_story.html?utm_term=.5322c7778b34,4free_Ukraine,"carter page,fbi,russia","trump,carter page,russia","fbi,trump,carter page",showed;foreign power russia;power russia;fbi showed;showed probable cause that trump,"fbi,trump,carter page,carter,page,russia"
