ID,HashTags,Tweet IDs,Time,TweetText,mentions_other,URL,User,calai_candidates,test_candidates,stanford_candidates,twiner_candidates,phase2_gt
1,RussiaGate,8.52E+017,4/12/2017 0:26,"REPORT: FBI Obtained FISA Warrant For Trump Aide, Believed He Was 'Agent Of The Russian Government'","FBI, FISA, Trump, Russian Government",https://www.washingtonpost.com/world/national-security/fbi-obtained-fisa-warrant-to-monitor-former-trump-adviser-carter-page/2017/04/11/620192ea-1e0e-11e7-ad74-3a742a6e93a7_story.html,JanKimbrough,"aide,russian government,fisa,fbi","fbi,trump aide,the russian government","fbi,trump",agent of the russian government;warrant;fbi obtained;fisa warrant;obtained fisa warrant for,"fbi,fisa,trump,russian government,russian"
2,,8.52E+017,4/12/2017 0:26,BUSTED....,,https://www.washingtonpost.com/world/national-security/fbi-obtained-fisa-warrant-to-monitor-former-trump-adviser-carter-page/2017/04/11/620192ea-1e0e-11e7-ad74-3a742a6e93a7_story.html?pushid=58ed633d5906281d0000000c&tid=notifi_push_breaking-news&utm_term=,zi_cam,,,,busted,
3,,8.52E+017,4/12/2017 0:26,"Carter Page is trending but 3 weeks ago there were no FISA warrants on team Trump.

I love how liberals have a 36 hour memory","Carter Page, FISA, Trump; liberals",,sicsemp4ever,"fisa,carter page",carter page,carter page,trending but 3 weeks;weeks;page is;but 3 weeks;is trending,"carter page,carter,page, fisa, trump; liberals"
4,,8.52E+017,4/12/2017 0:26,Looks like it might be time for some more tomahawks…,tomahawks,https://twitter.com/nickmerrill/status/851940541151543296,raponikoff,,,,some more tomahawksâ¦;tomahawksâ¦;like it might;like;it might be,tomahawks
5,,8.52E+017,4/12/2017 0:26,Sean Spicer on Carter Page:,"Sean Spicer, Carter Page",,MsEntropy,"carter page,sean spicer","sean spicer,carter page","sean spicer,carter page:",spicer;spicer on carter page;sean spicer;on;sean spicer on carter page,"sean spicer, sean, spicer, carter page,carter,page"
6,FISA,8.52E+017,4/12/2017 0:26,"""Carter Page""  @FBI @AdamSchiffCA @MarkWarner @NancyPelosi @HillaryClinton @MSNBC @maddow @washingtonpost","Carter Page,",,Class_of_78,"carter page,fbi",carter page,,page fbi adamschiffca;carter page fbi adamschiffca;washingtonpost;adamschiffca;page fbi,"carter page,carter,page"
7,,8.52E+017,4/12/2017 0:26,"I get stuck on things. Tonight's special, Session brought in Carter Page, a foreign agent:",";Session, Carter Page",http://www.palmerreport.com/news/confirmed-jeff-sessions-first-introduced-russian-operative-carter-page-to-donald-trump/1760/,cjpfeiff,carter page,carter page,,stuck on things tonight;carter page a foreign agent;get stuck on things;on things;i get stuck,"session, carter page,carter,page"
8,,8.52E+017,4/12/2017 0:26,I guess this explains the interview he gave after Flynn resigned where he blathered incoherently when asked about his contact with Russians,"Flynn,Russians",https://twitter.com/i/web/status/851954669878489089,pignponyrfriend,"he,he,his,flynn","flynn,russians",flynn,i guess this;guess;guess this;this;i,"flynn,russians"
9,,8.52E+017,4/12/2017 0:26,May the media never lose focus,,https://twitter.com/washingtonpost/status/851936422751870977,itsShonny,,,,never lose focus;may the;the media never lose focus;may;lose focus,
10,,8.52E+017,4/12/2017 0:26,"@CassandraRules Looks like someone else is having a bad day and looks like @LouiseMensch was right!
",,https://www.washingtonpost.com/world/national-security/fbi-obtained-fisa-warrant-to-monitor-former-trump-adviser-carter-page/2017/04/11/620192ea-1e0e-11e7-ad74-3a742a6e93a7_story.html?pushid=58ed633d5906281d0000000c&tid=notifi_push_breaking-news&utm_term=,GilesBgiles1974,,,,louisemensch was right;like someone else is;looks like louisemensch was right;else;like,
11,,8.52E+017,4/12/2017 0:26,Well well well. Guess that Susan Rice nonsense can go away now. Still about the leak problem?,;Susan Rice;,https://twitter.com/brianklaas/status/851953170448343040,em_div,susan rice,susan rice,susan rice,well well guess;leak problem;well well guess that susan;well well;well guess that susan,susan rice
12,,8.52E+017,4/12/2017 0:26,"@FoxNews @krauthammer ,,Trump's team of foreign policy advisers  Carter Page 
","Trump, Carter Page",http://www.cnn.com/2016/03/21/politics/donald-trump-foreign-policy-team/index.html,Bennythesnitch,carter page,"trump,carter page",carter page,foxnews krauthammer;policy advisers carter page;team;krauthammer trump team;krauthammer trump team of,"trump, carter page,carter,page"
13,,8.52E+017,4/12/2017 0:26,No wonder Carter Page is the Trump advisor that other Trump staffers deny ever seeing at Trump Tower.  He's one of the most complicit.,"Carter Page,Trump,Trump,Trump Tower;",,mallsta,"advisor,carter page,he,trump tower","carter page,trump,trump,trump tower.he","carter page,trump,trump,trump",of the most complicit;wonder;trump;one of the most complicit;no wonder carter,"carter page,carter,page,trump,trump,trump,trump tower;"
14,,8.52E+017,4/12/2017 0:26,@BrianPaulStuart @realDonaldTrump And now Steele the Savior is going to be proven to be a hack!,"Steele,Savior",http://www.foxnews.com/politics/2017/04/11/carter-page-fbi-reportedly-obtained-fisa-warrant-to-monitor-ex-trump-adviser.html,EricJGilbert,savior,steele,steele the savior,steele;and;realdonaldtrump;be a hack;realdonaldtrump and,"steele,savior"
15,,8.52E+017,4/12/2017 0:26,"@chrislhayes Please ask Trump, why he chose Carter Page.  Who told him to hire him?","Trump,Carter Page;",,berserkbd,"who,carter page,he,him,him","trump,carter page",carter,why;ask trump why;chrislhayes please;told him to hire him;him to hire him,"trump,carter page,carter,page"
16,,8.52E+017,4/12/2017 0:26,Report: FBI granted FISA warrant to surveil ex-Trump aide Carter Page | TheHill,"FBI,FISA, Carter Page;",http://thehill.com/policy/cybersecurity/328399-report-fbi-granted-fisa-warrant-to-surveil-ex-trump-aide-carter-page,ngunn7,"aide,fisa,carter page,fbi","fbi,carter page","fbi,fisa",granted;carter page thehill;report fbi granted;ex-trump aide carter page thehill;warrant,"fbi,fisa, carter page,carter,page"
17,deray,8.52E+017,4/12/2017 0:26,The FBI obtained a FISA warrant last year to monitor Trump adviser Carter Page in a...  by  via @c0nvey,"FBI,FISA,Trump,Carter Page",http://ln.is/Xnt37,GaryKGreen,"fisa,carter page,fbi,adviser","fbi,trump,carter page","fbi,fisa,trump,carter page",in a by via c0nvey;obtained a fisa warrant;fbi obtained;by via c0nvey;fisa warrant,"fbi,fisa,trump,carter page,carter,page"
18,,8.52E+017,4/12/2017 0:26,Very well explained take on Carter/ Russia/ FISA/ Trump sitch.,"Carter,Russia,FISA,Trump",https://www.washingtonpost.com/world/national-security/fbi-obtained-fisa-warrant-to-monitor-former-trump-adviser-carter-page/2017/04/11/620192ea-1e0e-11e7-ad74-3a742a6e93a7_story.html?utm_term=.08f84c172d7a,jannypie,"fisa,carter,russia",carter russia fisa trump,,very well explained take;well;fisa trump sitch;take;carter russia fisa trump sitch,"carter,russia,fisa,trump"
19,,8.52E+017,4/12/2017 0:26,Maxine Waters. Mam. Esq. Keep On.,Maxine Waters;;;;,https://twitter.com/undefined/status/851937803281866753,thecircledancer,maxine waters,maxine waters,,keep on;waters;esq keep on;waters mam;on,maxine waters
20,trumprussia,8.52E+017,4/12/2017 0:23,"A warrant was issued to FBI last summer to monitor Carter Page who was acting as an agent of Russia
","FBI,Carter Page,Russia",,funder,"carter page,fbi,russia","fbi,carter page,russia","fbi,carter page,russia",warrant was;a;was issued to fbi;to fbi;a warrant,"fbi,carter page,carter,page,russia"
21,,8.52E+017,4/12/2017 0:26,FBI obtained FISA warrant to monitor former Trump adviser Carter Page - The Washington Post so there was surveillance,"FBI,FISA,Trump,Carter Page, Washington Post",https://www.washingtonpost.com/world/national-security/fbi-obtained-fisa-warrant-to-monitor-former-trump-adviser-carter-page/2017/04/11/620192ea-1e0e-11e7-ad74-3a742a6e93a7_story.html?utm_term=.03230f3e6621,LSURay,"fisa,carter page,fbi,adviser,the washington post","fbi,trump,carter page,the washington post","fbi,fisa,trump,washington post",to monitor;obtained fisa warrant to monitor;fbi obtained;obtained fisa;so there was surveillance,"fbi,fisa,trump,carter page,carter,page, washington post"
22,,8.52E+017,4/12/2017 0:26,"""Sean, say something really fucked up today maybe say Hocaust Centers or something so they don't talk about Carter Page""","Sean,Hocaust Centers,Carter Page",,Diane_Warren,"carter page,sean","sean,carter page","hocaust centers,carter",something really fucked up today;dont talk about carter page;say;really fucked up;say something,"sean,hocaust centers,carter page,carter,page"
23,,8.52E+017,4/12/2017 0:26,Great,,https://twitter.com/selectedwisdom/status/851951854518972416,CaronScott5,,,,great,
24,,8.52E+017,4/12/2017 0:26,"Just reported by Chris Hayes, Carter page was surveilled by FBI via FISA warrant. Buh bye, Carter.","Chris Hayes,Carter Page,FBI,FISA;Carter",https://twitter.com/counterchekist/status/851910798050029570,TrumpHaterShirt,"fisa,carter page,carter,fbi,chris hayes","chris hayes,carter page,carter","chris hayes, carter,fbi",buh bye carter;chris hayes carter;just;reported;bye carter,"chris hayes,carter page,carter,page,fbi,fisa,carter"
25,,8.52E+017,4/12/2017 0:26,FBI obtained FISA warrant to monitor former Trump adviser Carter Page.,"FBI,FISA,Trump,Carter Page",http://google.com/newsstand/s/CBIwyvP8zDk,christineltroch,"fisa,carter page,fbi,adviser","fbi,trump,carter page","fbi,fisa,trump,carter page.",fbi obtained fisa warrant;warrant;fbi obtained fisa;fbi obtained;obtained fisa,"fbi,fisa,trump,carter page,carter,page"
26,,8.52E+017,4/12/2017 0:26,This is huge. Bar for a FISA warrant targetting US person is knowingly acting as foreign agent in a way that violates,";FISA,US",https://twitter.com/i/web/status/851954745258512384,racheline_m,"fisa,us",,"fisa,us",way that violates;this is huge;for a fisa;violates;this,"fisa,us"
27,,8.52E+017,4/12/2017 0:26,Umm. Should we tell him he's delusional?,;,https://twitter.com/carney/status/851942259935367169,JetlifeMegs,"he,him",,,umm should;should;we tell him he delusional;should we tell;should we,
28,hardball,8.52E+017,4/12/2017 0:26,"Sean Spicer mis-spoke, Libs loved it, yet forget the DOJ still worked all day on indictments
 Carter Page","sean spicer,DOJ; Carter Page",https://twitter.com/i/web/status/851954759141556225,DCjusticeseeker,"doj,carter page,sean spicer","sean spicer,libs,indictmentscarter page","sean spicer,doj,carter page",on indictments carter page;spicer mis-spoke libs loved it;spicer;day on indictments carter page;sean spicer,"sean spicer, sean, spicer,doj; carter page,carter,page"
29,,8.52E+017,4/12/2017 0:26,@mcspocky Looks like Carter Page will be one of the first dominoes to fall. The Syria strike was a distraction away from . Stay focused,Carter Page;Syria strike;,https://twitter.com/i/web/status/851954764359376896,JrgLaw,"carter page,syria","carter page,syria","carter page,syria",like carter page will be;mcspocky;mcspocky looks;page will be;from stay focused,"carter page,carter,page,syria strike;"
30,,8.52E+017,4/12/2017 0:26,FBI secured FISA warrant against Carter Page over concerns he was 'was acting as an agent' of Russia | Raw Story,"FBI,FISA,Carter Page,Russia",https://www.rawstory.com/2017/04/revealed-fbi-secured-fisa-warrant-against-carter-page-over-concerns-he-was-was-acting-as-an-agent-of-russia/,blazinbabs67,"fisa,carter page,he,fbi,russia","carter page,russia","fbi,fisa,carter page,russia",fbi secured;agent of russia raw story;fisa warrant against carter;of russia raw story;secured fisa warrant,"fbi,fisa,carter page,carter,page,russia"
31,_flanders,8.52E+017,4/12/2017 0:27,The FBI obtained a FISA warrant last year to monitor Trump adviser Carter Page in...  by  via @c0nvey,"FBI,FISA,Trump,Carter Page",http://ln.is/e18ly,Sparblack1213,"fisa,carter page,fbi,adviser","fbi,trump,carter page","fbi,fisa,trump",obtained a fisa warrant;fbi obtained;by via c0nvey;fisa warrant;via c0nvey,"fbi,fisa,trump,carter page,carter,page"
32,,8.52E+017,4/12/2017 0:27,@seanhannity what about this spy...,,https://www.washingtonpost.com/world/national-security/fbi-obtained-fisa-warrant-to-monitor-former-trump-adviser-carter-page/2017/04/11/620192ea-1e0e-11e7-ad74-3a742a6e93a7_story.html?utm_term=.8c4bfd4add2d,pigs_wing,spy,,,about;what about;seanhannity;seanhannity what;what,
33,,8.52E+017,4/12/2017 0:27,Oh you don't say?,,https://twitter.com/mcspocky/status/851954186220654592,DixiDoodle,,,,say;oh you dont;oh;oh you dont say;oh you,
34,,8.52E+017,4/12/2017 0:27,@FoxNews @dkrwilliams @oreillyfactor WaPo: FBI wiretapped Trump sorta-adviser Carter Page in 2016. 'Only  American directly targeted with FISA warrant' by Dems &amp; Obama!,"FBI,Trump,Carter Page; American,FISA,Dems,Obama",https://twitter.com/i/web/status/851954795753730049,glennyork,"fisa,carter page,fbi","fbi,carter page,fisa,dems &amp; obama","fbi,trump",wapo fbi wiretapped trump;trump;oreillyfactor;amp obama;obama,"fbi,trump,carter page,carter,page; american,fisa,dems,obama"
35,,8.52E+017,4/12/2017 0:27,carter page you dumbass. c'mon carter. get a clue carter page,"Carter Page,carter",,LydiaBurrell,"carter page,carter page","carter page,carter page",,carter page you;dumbass;get a clue carter page;carter page;page you,"carter page,carter,page,carter,carter page,carter,page"
36,,8.52E+017,4/12/2017 0:27,Well at least this takes the heat off @PressSec,,https://twitter.com/maggieNYT/status/851936962533629952,LisaBednarski,,,,well at least;takes the heat off presssec;at least this;presssec;at,
37,,8.52E+017,4/12/2017 0:27,But Carter Page was Manafort's biz partner so he could have been caught in the surveillance,"Carter Page,Manafort",https://twitter.com/kenvogel/status/851940557211537409,omyword,"carter page,he",carter page,carter page,been caught in the surveillance;surveillance;was manafort;manafort;carter page,"carter page,carter,page,manafort"
38,,8.52E+017,4/12/2017 0:27,Most delicious part of the WaPo Carter Page story.,"WaPo,Carter Page",,HaroldItz,,carter page,wapo,wapo carter page story;most delicious part of;most delicious part;delicious part;page story,"wapo,carter page,carter,page"
39,,8.52E+017,4/12/2017 0:27,FBI obtained FISA warrant to monitor former Trump adviser Carter Page - The Washington Post,"FBI,FISA,Trump,Carter Page,Washington Post",https://www.washingtonpost.com/world/national-security/fbi-obtained-fisa-warrant-to-monitor-former-trump-adviser-carter-page/2017/04/11/620192ea-1e0e-11e7-ad74-3a742a6e93a7_story.html?tid=ss_tw&utm_term=.24b22dcdef1c,RadioChio,"fisa,carter page,fbi,adviser,the washington post","fbi,trump,carter page,the washington post","fbi,fisa,trump,washington post",the washington post;to;carter page the washington post;page the washington post;fbi obtained,"fbi,fisa,trump,carter page,carter,page,washington post"
40,inners,8.52E+017,4/12/2017 0:27,"So what will be the fate of Carter Page? Will he be mysteriously poisoned or accidentally ""fall"" out of a 4th-story window?",Carter Page;,,MeLoseBrainUhOh,"carter page,he",carter page,carter,be the fate of;so what;a 4th-story window;window;of a 4th-story window,"carter page,carter,page;"
41,TrumpRussia,8.52E+017,4/12/2017 0:27,We now return to or regularly scheduled program.,,https://twitter.com/thedailybeast/status/851942406425649152,RyGil01,,,,to;we now;return to;now;program,
42,,8.52E+017,4/12/2017 0:27,"Drips become waterfall, part I.",,https://www.washingtonpost.com/world/national-security/fbi-obtained-fisa-warrant-to-monitor-former-trump-adviser-carter-page/2017/04/11/620192ea-1e0e-11e7-ad74-3a742a6e93a7_story.html?utm_term=.aea8042b372a,charnesshartman,,,,become waterfall;part i;drips become;waterfall;become waterfall part i,
43,,8.52E+017,4/12/2017 0:25,and again a bang up job by jim comey letting the public know who was under investigation last summer,jim comey,https://www.washingtonpost.com/world/national-security/fbi-obtained-fisa-warrant-to-monitor-former-trump-adviser-carter-page/2017/04/11/620192ea-1e0e-11e7-ad74-3a742a6e93a7_story.html?utm_term=.3f6757782bce,marcushjohnson,,jim,,and;was under investigation last summer;again a bang up job;a;a bang up job by,"comey,jim comey"
44,"TrumpRussia, TheResistance",8.52E+017,4/12/2017 0:27,"@ funder  
",,https://twitter.com/funder/status/851954007383920640,NoAltFacts1984,,,,funder,
45,sarahsettgo,8.52E+017,4/12/2017 0:27,The FBI obtained a FISA warrant last year to monitor Trump adviser Carter Page...  by  via @c0nvey,"FBI,FISA,Trump,Carter Page;",http://ln.is/N3MuD,StonZMGMT,"fisa,carter page,fbi,adviser","fbi,trump,carter page","fbi,fisa,trump,carter",page by via c0nvey;carter page by via c0nvey;warrant;obtained a fisa warrant;fbi obtained,"fbi,fisa,trump,carter page,carter,page;"
46,,8.52E+017,4/12/2017 0:27,"Back on the front page where it belongs. It should only be a few minutes before the next crazy diversion.

 
",;,https://twitter.com/i/web/status/851954821410181120,ZazuRules,,,,the next crazy diversion;where;on;the front page where it;back,
47,thingsweheart,8.52E+017,4/12/2017 0:27,FBI obtained a FISA warrant last summer to monitor Trump adviser Carter Page...  by  via @c0nvey,"FBI,FISA,Trump,Carter Page;",http://ln.is/1VUCt,DecentFida,"fisa,carter page,fbi,adviser","fbi,trump,carter page","fbi,fisa,trump,carter",warrant last;a fisa warrant last;a;carter page by via c0nvey;warrant,"fbi,fisa,trump,carter page,carter,page"
48,,8.52E+017,4/12/2017 0:27,GOP and DEM Sorosian trolls out in full force 2 keep Carter Page from trending ps does George have healthcare perks?,"GOP,DEM,Sorosian,Carter Page,George,healthcare",https://www.washingtonpost.com/world/national-security/fbi-obtained-fisa-warrant-to-monitor-former-trump-adviser-carter-page/2017/04/11/620192ea-1e0e-11e7-ad74-3a742a6e93a7_story.html?utm_term=.1a2f1f45a5f2,tiwhitter,"gop,healthcare,carter page,dem","dem sorosian,carter page,george","gop,george",and;dem;does george have healthcare perks;and dem sorosian;healthcare perks,"gop,dem,sorosian,carter page,carter,page,george,healthcare"
49,,8.52E+017,4/12/2017 0:27,Ahh... hello?!,;;,https://twitter.com/amy_siskind/status/851946192376401920,pammy_facepaint,,,,ahh;ahh hello;hello,
50,,8.52E+017,4/11/2017 23:14,The FBI obtained a FISA warrant last year to monitor Trump adviser Carter Page in a probe of campaign’s Russia ties,"FBI,FISA, Trump,Carter Page,Russia",,kwanzer,"fisa,carter page,fbi,russia,adviser","fbi,trump,carter page,russia","fbi,fisa,trump,carter page,russia",probe of campaignâs russia ties;russia ties;warrant;obtained a fisa warrant;fbi obtained,"fbi,fisa, trump,carter page,carter,page,russia"
51,,8.52E+017,4/12/2017 0:27,"Carter Page claims the FBI/JD wire tap is just like when the FBI tapped Dr.King... yeah, brah, just like that...except not in every way.","Carter Page,FBI,JD,FBI,Dr.King;",,Aarapparent,"carter page,fbi,fbi,king","carter page,fbi,king","carter page,fbi",tap;that...except not in every way;fbi/jd wire tap;in every way;not in every way,"carter page,carter,page,fbi/jd,fbi,dr.king"
52,,8.52E+017,4/12/2017 0:27,FBI obtained FISA warrant to monitor former Trump adviser Carter Page via /r/politics,"FBI,FISA,Trump,Carter Page",http://ift.tt/2p3m6Gi,SubPolitics,"fisa,carter page,fbi,adviser","fbi,trump,carter page","fbi,fisa,trump",to;fbi obtained;obtained fisa;obtained fisa warrant to;adviser carter page via r/politics,"fbi,fisa,trump,carter page,carter,page"
53,,8.52E+017,4/12/2017 0:27,A FISA warrant against US national requires evidence they knowingly participated in clandestine intel ops.,"FISA, US",https://www.washingtonpost.com/world/national-security/fbi-obtained-fisa-warrant-to-monitor-former-trump-adviser-carter-page/2017/04/11/620192ea-1e0e-11e7-ad74-3a742a6e93a7_story.html?utm_term=.6aaa4183fee4,BrianNormoyle,"fisa,us,intel",us national,us,in clandestine intel ops;a;participated in clandestine intel ops;warrant;fisa warrant,"fisa, us"
54,,8.52E+017,4/12/2017 0:27,@rideatdawn Nah... hack dossier damn it!,;,http://www.foxnews.com/politics/2017/04/11/carter-page-fbi-reportedly-obtained-fisa-warrant-to-monitor-ex-trump-adviser.html,EricJGilbert,,,,nah hack;nah;rideatdawn nah hack;rideatdawn nah;hack,
55,,8.52E+017,4/12/2017 0:27,This Breitbart guy.,Breitbart,https://twitter.com/carney/status/851942259935367169,snottypants,,,breitbart,this breitbart;breitbart;this;breitbart guy;guy,breitbart
56,,8.52E+017,4/12/2017 0:27,"If Nunes saw Carter Page unmasked on a FISA warrant, no wonder he ran to the White House...wonder what else he saw? Rep Schiff do your thing","Nunes,FISA,Carter Page,White House;Rep Schiff",,spokanetom,"fisa,carter page,he,he,white house,nunes","nunes,carter page,white house","nunes,carter page,schiff",rep schiff do your thing;nunes saw;on;saw;page unmasked on,"nunes,fisa,carter page,carter,page,white house,rep schiff"
57,,8.52E+017,4/12/2017 0:27,@united just gave lifetime premier status to @PressSec and Carter Page.,Carter Page,,BrianWithAnE,carter page,carter page,carter page.,lifetime;united just;just gave lifetime;just;gave lifetime,"carter page,carter,page"
58,,8.52E+017,4/12/2017 0:27,FBI obtained FISA warrant to monitor former Trump adviser Carter Page,"FBI,FISA,Trump,Carter Page",http://hrld.us/2prvRe1,ele_wolfe,"fisa,carter page,fbi,adviser","fbi,trump,carter page","fbi,fisa,trump,carter page",fbi obtained fisa warrant;warrant;fbi obtained fisa;fbi obtained;obtained fisa,"fbi,fisa,trump,carter page,carter,page"
59,,8.52E+017,4/12/2017 0:27,"But the problem is the leaks, right 45?",,https://twitter.com/abbydphillip/status/851936736330559488,mdh9876,,,,but the;problem is;the problem is;the leaks right 45;right 45,
60,,8.52E+017,4/12/2017 0:27,@RDebag @jaketapper @MichLKosinski Like I said (and the FBI said) Zero evidence. Just BS conjecture. Is carter page being charged? No.,FBI;;Carter Page;,,Inglorious123,"carter page,fbi",carter page,fbi,michlkosinski like i said;jaketapper michlkosinski;i said;said;charged no,"fbi, carter page,carter,page"
61,"TrumpRussia, LoserPOTUS",8.52E+017,4/12/2017 0:27,"The walls inch ever closer. Hang in there, folks. Stay focused on  and  will be gone soon.",;;,https://www.washingtonpost.com/world/national-security/fbi-obtained-fisa-warrant-to-monitor-former-trump-adviser-carter-page/2017/04/11/620192ea-1e0e-11e7-ad74-3a742a6e93a7_story.html,BillSchultzeJr,,,,gone soon;will be gone soon;walls;be gone soon;soon,
62,"spicer, SyriaStrikes, TrumpRussiaCollusion",8.52E+017,4/12/2017 0:27,Enough of  and  let's get back to the basics,,https://www.washingtonpost.com/world/national-security/fbi-obtained-fisa-warrant-to-monitor-former-trump-adviser-carter-page/2017/04/11/620192ea-1e0e-11e7-ad74-3a742a6e93a7_story.html?utm_term=.3b6d0e8b375a,RobertDriemeyer,,,,let;and;enough of;of and let;of and let get,
63,,8.52E+017,4/12/2017 0:27,"""Carter Page""",Carter Page,,justsickoflies,carter page,carter page,,carter page;carter;page,"carter page,carter,page"
64,,8.52E+017,4/12/2017 0:27,Comrade Comey did as his Puppet Master ordered.,"Comrade Comey,Puppet Master",https://twitter.com/owillis/status/851954343330942976,truth_trumpet,"his,comey",,comey,comey;comrade comey did;comey did as;ordered;did,"comey,comrade comey,puppet master"
65,,8.52E+017,4/12/2017 0:27,@FoxNews @dkrwilliams @oreillyfactor FBI  / Hillary's Andrew McCabe was secretly working with Lynch/Obama/Rice to spy on Donald Trump team VIA any means necessary! Carter Page,"FBI,Hillary,Andrew McCabe,Lynch, Obama, Rice, Donald Trump; Carter Page",https://twitter.com/i/web/status/851954883049775104,glennyork,"hillary,carter page,fbi,andrew mccabe","fbi,hillary,andrew mccabe,donald trump,carter page","fbi,andrew mccabe,donald trump",oreillyfactor;foxnews dkrwilliams oreillyfactor;dkrwilliams oreillyfactor;fbi hillary andrew mccabe;necessary carter page,"fbi,hillary,andrew mccabe,lynch/obama/rice,trump, donald trump,carter page,carter,page"
66,,8.52E+017,4/12/2017 0:27,Here we go again...,,https://twitter.com/Impeach_D_Trump/status/851954013041905664,WhyAsk65,,,,again;we go again;here we go;we;here,
67,,8.52E+017,4/12/2017 0:27,FISA court granted FBI authority to monitor Trump adviser Carter Page during campaign:  via @slate,"FISA,FBI,Trump,Carter Page",http://www.slate.com/blogs/the_slatest/2017/04/11/fisa_court_allowed_fbi_surveillance_of_trump_adviser_carter_page_during.html?wpsrc=sh_all_dt_tw_top,slatest,"carter page,fbi,fisa court,adviser","trump,carter page","fbi,trump,carter page",granted;fisa court granted;during campaign via slate;via slate;page during campaign via slate,"fisa,fbi,trump,carter page,carter,page"
68,,8.52E+017,4/12/2017 0:27,So proof that Trump's team was colluding with the Russians,"Trump,Russians",https://www.washingtonpost.com/world/national-security/fbi-obtained-fisa-warrant-to-monitor-former-trump-adviser-carter-page/2017/04/11/620192ea-1e0e-11e7-ad74-3a742a6e93a7_story.html?utm_term=.769a92c1f5d9,Karadur_Zero,,trump,,trump;with the russians;so proof that trump;was colluding with the russians;proof that,"trump,russians"
69,,8.52E+017,4/12/2017 0:27,Well...,,https://twitter.com/washingtonpost/status/851936422751870977,DalanOverstreet,,,,well,
70,"inners, msnbc, cnn",8.52E+017,4/12/2017 0:27,Who Is Carter Page? A Liar. 8 Things You Need to Know About the Former Trump Adviser.,Carter Page;;Trump,http://www.cosmopolitan.com/politics/a9112629/carter-page-former-trump-adviser-facts/,BlackJesuscom,"who,carter page,adviser",carter page,"carter,trump adviser.",is carter page a liar;adviser;who;trump adviser;liar,"carter page,carter,page; trump"
71,,8.52E+017,4/12/2017 0:27,He's busy trying to destroy the lives of minorities across the country.,,https://twitter.com/tedlieu/status/851948388115337216,jmichaelkell,he,,,busy trying to;to;he busy;across the country;country,
72,,8.52E+017,4/12/2017 0:27,Sure hope he does and soon.,,https://twitter.com/KeithOlbermann/status/851949276703981568,sdbees1953,he,,,he does and soon;sure;he;soon;hope he,
